B2: RESULTATS - ORIENTEERING URV 2012
B3: 09 Novembre 2012 | I3: www.airelliure.net
B4: H OPEN | D4: SÈRIE A | H4: SÈRIE B
D5: SORTIDA | E5: ARRIBADA | F5: TEMPS | H5: SORTIDA | I5: ARRIBADA | J5: TEMPS | L5: TOTAL
B6: Alejandro | C6: HERNÁNDEZ BRULL | D6: 0.33819444444444446 | E6: 0.35078703703703701 | F6: =E6-D6 -> 1.2592592592592544E-2 | H6: 0.31388888888888888 | I6: 0.3253240740740741 | J6: =I6-H6 -> 1.1435185185185215E-2 | L6: = J6 + F6 -> 2.4027777777777759E-2
B7: Dani | C7: Buyo | D7: 0.3347222222222222 | E7: 0.34833333333333333 | F7: =E7-D7 -> 1.3611111111111129E-2 | H7: 0.31805555555555554 | I7: 0.33046296296296296 | J7: =I7-H7 -> 1.2407407407407423E-2 | L7: = J7 + F7 -> 2.6018518518518552E-2
B8: Eloi | C8: ROSICH RIBAS | D8: 0.31319444444444444 | E8: 0.3298611111111111 | F8: =E8-D8 -> 1.6666666666666663E-2 | H8: 0.33333333333333331 | I8: 0.34652777777777777 | J8: =I8-H8 -> 1.3194444444444453E-2 | L8: = J8 + F8 -> 2.9861111111111116E-2
B9: Francisco Javier | C9: Domínguez Serrano | D9: 0.3347222222222222 | E9: 0.3558912037037037 | F9: =E9-D9 -> 2.1168981481481497E-2 | H9: 0.31388888888888888 | I9: 0.33031250000000001 | J9: =I9-H9 -> 1.6423611111111125E-2 | L9: = J9 + F9 -> 3.7592592592592622E-2
B10: Marc | C10: Segur Domingo | D10: 0.32916666666666666 | E10: 0.34972222222222221 | F10: =E10-D10 -> 2.0555555555555549E-2 | H10: 0.31111111111111112 | I10: 0.32848379629629632 | J10: =I10-H10 -> 1.7372685185185199E-2 | L10: = J10 + F10 -> 3.7928240740740748E-2
B11: Marc | C11: Garcia Civit | D11: 0.33680555555555558 | E11: 0.36049768518518516 | F11: =E11-D11 -> 2.3692129629629577E-2 | H11: 0.31458333333333333 | I11: 0.32996527777777779 | J11: =I11-H11 -> 1.5381944444444462E-2 | L11: = J11 + F11 -> 3.9074074074074039E-2
B12: FRANCESC | C12: RAVELL | D12: 0 | E12: 0 | F12: abandó | H12: 0.31041666666666667 | I12: 0 | J12: abandó | L12: abandó
B13: Sebastián | C13: Ordóñez Ibáñez | D13: 0.32500000000000001 | E13: 0.33648148148148144 | F13: =E13-D13 -> 1.1481481481481426E-2 | H13: 0.34722222222222227 | I13: 0.35865740740740742 | J13: error | L13: error
B14: JORDI | C14: ORTEGA SARLÉ | D14: 0.33263888888888887 | E14: 0.34814814814814815 | F14: =E14-D14 -> 1.5509259259259278E-2 | H14: 0.31388888888888888 | I14: 0.32678240740740744 | J14: error | L14: error
B15: César | C15: VALERO CARRUESCO | D15: 0.31458333333333333 | E15: 0.33275462962962959 | F15: error | H15: 0.33611111111111108 | I15: 0.34710648148148149 | J15: =I15-H15 -> 1.0995370370370405E-2 | L15: error
B16: David | C16: DE MINGO LOPEZ | D16: 0 | E16: 0 | F16: no surt | H16: 0 | I16: 0 | J16: no surt | L16: no surt
B17: Jordi | C17: GRAU ALASA | D17: 0 | E17: 0 | F17: no surt | H17: 0 | I17: 0 | J17: no surt | L17: no surt
B18: Miki | C18: JORGE TORTAJADA | D18: 0 | E18: 0 | F18: no surt | H18: 0 | I18: 0 | J18: no surt | L18: no surt
B21: D OPEN | D21: SÈRIE A | H21: SÈRIE B
D22: SORTIDA | E22: ARRIBADA | F22: TEMPS | H22: SORTIDA | I22: ARRIBADA | J22: TEMPS | L22: TOTAL
B23: Esther | C23: TRULLOLS SOLER | D23: 0 | E23: 0 | F23: abandó | H23: 0.31319444444444444 | I23: 0 | J23: abandó | L23: abandó
B24: MClara | C24: CABÚS LLAURADÓ | D24: 0.35347222222222219 | E24: 0 | F24: error | H24: 0.31944444444444448 | I24: 0.3520138888888889 | J24: =I24-H24 -> 3.2569444444444429E-2 | L24: error
B25: Blanca | C25: Foix Salló | D25: 0.31458333333333333 | E25: 0.33900462962962963 | F25: =E25-D25 -> 2.4421296296296302E-2 | H25: 0.34236111111111112 | I25: 0.35890046296296302 | J25: error | L25: error
B26: Karina | C26: Nieva Corzo | D26: 0 | E26: 0 | F26: no surt | H26: 0 | I26: 0 | J26: no surt | L26: no surt
B29: H UNI | D29: SÈRIE A | H29: SÈRIE B
D30: SORTIDA | E30: ARRIBADA | F30: TEMPS | H30: SORTIDA | I30: ARRIBADA | J30: TEMPS | L30: TOTAL
B31: Bartomeu | C31: ANGULO SALONEN | D31: 0.31666666666666665 | E31: 0.33263888888888887 | F31: =E31-D31 -> 1.5972222222222221E-2 | H31: 0.33611111111111108 | I31: 0.34768518518518521 | J31: =I31-H31 -> 1.1574074074074125E-2 | L31: = J31 + F31 -> 2.7546296296296346E-2
B32: JOAN | C32: IDIARTE | D32: 0.33124999999999999 | E32: 0.35030092592592593 | F32: =E32-D32 -> 1.9050925925925943E-2 | H32: 0.31597222222222221 | I32: 0.32938657407407407 | J32: =I32-H32 -> 1.3414351851851858E-2 | L32: = J32 + F32 -> 3.2465277777777801E-2
B33: IZHAR | C33: TORRES | D33: 0.32916666666666666 | E33: 0.35027777777777774 | F33: =E33-D33 -> 2.1111111111111081E-2 | H33: 0.31597222222222221 | I33: 0.32920138888888889 | J33: =I33-H33 -> 1.3229166666666681E-2 | L33: = J33 + F33 -> 3.4340277777777761E-2
B34: DIDAC | C34: BANÚS | D34: 0.31597222222222221 | E34: 0.3442708333333333 | F34: =E34-D34 -> 2.8298611111111094E-2 | H34: 0.34583333333333338 | I34: 0.36305555555555552 | J34: =I34-H34 -> 1.7222222222222139E-2 | L34: = J34 + F34 -> 4.5520833333333233E-2
B35: Jaume | C35: Carmona López | D35: 0.3125 | E35: 0.33807870370370369 | F35: =E35-D35 -> 2.5578703703703687E-2 | H35: 0.34027777777777773 | I35: 0.36034722222222221 | J35: =I35-H35 -> 2.0069444444444473E-2 | L35: = J35 + F35 -> 4.564814814814816E-2
B36: MARC | C36: RAMON | D36: 0.31597222222222221 | E36: 0.34453703703703703 | F36: =E36-D36 -> 2.8564814814814821E-2 | H36: 0.34583333333333338 | I36: 0.36312499999999998 | J36: =I36-H36 -> 1.7291666666666594E-2 | L36: = J36 + F36 -> 4.5856481481481415E-2
B37: MARIO | C37: ALONSO | D37: 0 | E37: 0 | F37: abandó | H37: 0.31527777777777777 | I37: 0.3520949074074074 | J37: error | L37: error
B40: D UNI | D40: SÈRIE A | H40: SÈRIE B
D41: SORTIDA | E41: ARRIBADA | F41: TEMPS | H41: SORTIDA | I41: ARRIBADA | J41: TEMPS | L41: TOTAL
B42: MONTSERRAT | C42: CODINA | D42: 0.31736111111111115 | E42: 0.33842592592592591 | F42: =E42-D42 -> 2.1064814814814758E-2 | H42: 0.34027777777777773 | I42: 0.36181712962962959 | J42: =I42-H42 -> 2.1539351851851851E-2 | L42: = J42 + F42 -> 4.260416666666661E-2
B43: CRISA | C43: VARGAS | D43: 0.31666666666666665 | E43: 0.36082175925925924 | F43: =E43-D43 -> 4.4155092592592593E-2 | H43: 0.33680555555555558 | I43: 0.35148148148148151 | J43: =I43-H43 -> 1.4675925925925926E-2 | L43: = J43 + F43 -> 5.8831018518518519E-2
B44: MONTSE | C44: FIBLA | D44: 0.35347222222222219 | E44: 0.3659722222222222 | F44: error | H44: 0.31666666666666665 | I44: 0.34844907407407405 | J44: =I44-H44 -> 3.1782407407407398E-2 | L44: error
B45: GLORIA | C45: SOBRERO | D45: 0 | E45: 0 | F45: no surt | H45: 0 | I45: 0 | J45: =I45-H45 -> 0 | L45: no surt
B46: MARIBEL | C46: YEPES | D46: 0 | E46: 0 | F46: no surt | H46: 0 | I46: 0 | J46: =I46-H46 -> 0 | L46: no surt
B47: ALBA | C47: CABALLÉ | D47: 0.35347222222222219 | E47: 0.3659722222222222 | F47: error | H47: 0.31736111111111115 | I47: 0.35037037037037039 | J47: =I47-H47 -> 3.3009259259259238E-2 | L47: error
B48: IRAIDA | C48: SOUSA | D48: 0 | E48: 0 | F48: no surt | H48: 0 | I48: 0 | J48: no surt | L48: no surt
B51: DUO | D51: SÈRIE A | H51: SÈRIE B
D52: SORTIDA | E52: ARRIBADA | F52: TEMPS | H52: SORTIDA | I52: ARRIBADA | J52: TEMPS | L52: TOTAL
B53: ADRIAN | C53: PRADA SEVILLA | D53: 0.31180555555555556 | E53: 0.33344907407407409 | F53: =E53-D53 -> 2.1643518518518534E-2 | H53: 0.33402777777777781 | I53: 0.35254629629629625 | J53: =I53-H53 -> 1.8518518518518434E-2 | L53: = J53 + F53 -> 4.0162037037036968E-2
B54: ESTER | C54: GALINDO MORILLA | D54: 0.31180555555555556 | E54: 0.33344907407407409 | F54: =E54-D54 -> 2.1643518518518534E-2 | H54: 0.33402777777777781 | I54: 0.35254629629629625 | J54: =I54-H54 -> 1.8518518518518434E-2 | L54: = J54 + F54 -> 4.0162037037036968E-2
B55: Mayra | C55: García | D55: 0.31944444444444448 | E55: 0.34842592592592592 | F55: =E55-D55 -> 2.8981481481481441E-2 | H55: 0.35555555555555557 | I55: 0.37638888888888888 | J55: =I55-H55 -> 2.0833333333333315E-2 | L55: = J55 + F55 -> 4.9814814814814756E-2
B56: Vanessa | C56: Torné | D56: 0.31944444444444448 | E56: 0.34844907407407405 | F56: =E56-D56 -> 2.9004629629629575E-2 | H56: 0.35555555555555557 | I56: 0.37638888888888888 | J56: =I56-H56 -> 2.0833333333333315E-2 | L56: = J56 + F56 -> 4.983796296296289E-2
B57: Meritxell | C57: CALBET MONTCUSÍ | D57: 0.34791666666666665 | E57: 0.37777777777777777 | F57: =E57-D57 -> 2.9861111111111116E-2 | H57: 0.31736111111111115 | I57: 0.34574074074074074 | J57: error | L57: error
B58: Antonio | C58: BASILE | D58: 0.34791666666666665 | E58: 0.37777777777777777 | F58: =E58-D58 -> 2.9861111111111116E-2 | H58: 0.31736111111111115 | I58: 0.34574074074074074 | J58: error | L58: error
B59: JULIA | C59: VERDERAS GALLARDO | D59: 0.31805555555555554 | E59: 0.35774305555555558 | F59: error | H59: 0.35833333333333334 | I59: 0.3833333333333333 | J59: error | L59: error
B60: ALBERT | C60: FARRÉ BRAVO | D60: 0.31805555555555554 | E60: 0.35774305555555558 | F60: error | H60: 0.35833333333333334 | I60: 0.3833333333333333 | J60: error | L60: error
B61: Esther | C61: AYALA MASONI | D61: 0 | E61: 0 | F61: no surt | H61: 0 | I61: 0 | J61: no surt | L61: no surt
B62: Marc | C62: Segú Domingo | D62: 0 | E62: 0 | F62: no surt | H62: 0 | I62: 0 | J62: no surt | L62: no surt
B65: JUNIOR | D65: SÈRIE A | H65: SÈRIE B
D66: SORTIDA | E66: ARRIBADA | F66: TEMPS | H66: SORTIDA | I66: ARRIBADA | J66: TEMPS | L66: TOTAL
B67: Alfred | C67: FIGUERAS ANTON | D67: 0.33333333333333331 | E67: 0.34814814814814815 | F67: =E67-D67 -> 1.4814814814814836E-2 | H67: 0.31527777777777777 | I67: 0.32883101851851854 | J67: =I67-H67 -> 1.3553240740740768E-2 | L67: = J67 + F67 -> 2.8368055555555605E-2
B68: Gerard | C68: Pérez Griso | D68: 0.32361111111111113 | E68: 0.3435185185185185 | F68: =E68-D68 -> 1.9907407407407374E-2 | H68: 0.34722222222222227 | I68: 0.36351851851851852 | J68: =I68-H68 -> 1.6296296296296253E-2 | L68: = J68 + F68 -> 3.6203703703703627E-2
B69: Claudia | C69: VALERO DE LA FLOR | D69: 0.31736111111111115 | E69: 0.3449652777777778 | F69: =E69-D69 -> 2.7604166666666652E-2 | H69: 0.34583333333333338 | I69: 0.36372685185185188 | J69: =I69-H69 -> 1.7893518518518503E-2 | L69: = J69 + F69 -> 4.5497685185185155E-2
B70: JUDIT | C70: RAVELL SOLÉ | D70: 0.33750000000000002 | E70: 0.37187500000000001 | F70: error | H70: 0 | I70: 0 | J70: abandó | L70: error
B71: Gabriel | C71: DOMINGUEZ SANTIAGO | D71: 0.31527777777777777 | E71: 0 | F71: abandó | H71: 0 | I71: 0 | J71: =I71-H71 -> 0 | L71: abandó
B72: ENRIC | C72: BERTRAN GARCIA DE OLALLA | D72: 0.31736111111111115 | E72: 0.33483796296296298 | F72: =E72-D72 -> 1.7476851851851827E-2 | H72: 0.33750000000000002 | I72: 0.35188657407407403 | J72: error | L72: error