B2: LLISTAT D'INSCRITS
C3: credits | D3: 17 | E3: 19 | F3: 21 | G3: 24 | H3: 26 | I3: 28 | J3: 5
A4: 1 | B4: CALVO AGUILAR, IRENE | C4: SI | D4: x | E4: x | F4: x | G4: x | H4: x | I4: x | J4: x
A5: =SUM(A4)+1 -> 2 | B5: DÓNIGA LASHERAS, PABLO | C5: SI | D5: x | E5: x | F5: x | G5: x | H5: x | I5: x | J5: x
A6: =SUM(A5)+1 -> 3 | B6: DURAN RUBIO, ELISABET | C6: SI | D6: x | E6: x | F6: x | G6: x | H6: x | I6: x | J6: x
A7: =SUM(A6)+1 -> 4 | B7: FUENTES BENAVENTE, RAQUEL | C7: SI | D7: x | E7: x | F7: x | G7: x | H7: x | I7: x | J7: x
A8: =SUM(A7)+1 -> 5 | B8: GALLEGO PEREZ, ANGELA | C8: SI | D8: x | E8: x | F8: x | G8: x | H8: x | I8: x | J8: x
A9: =SUM(A8)+1 -> 6 | B9: GARCIA CIVIT, MARC | C9: NO | D9: x | E9: x | F9: x | G9: x | H9: x | I9: x | J9: x
A10: =SUM(A9)+1 -> 7 | B10: LÓPEZ ESCRIU, IGNACIO | C10: SI | D10: x | E10: x | F10: x | G10: x | H10: x | I10: x | J10: x
A11: =SUM(A10)+1 -> 8 | B11: MARTÍ ARMENGOL, ADRIA | C11: SI | D11: x | E11: x | F11: x | G11: x | H11: x | I11: x | J11: x
A12: =SUM(A11)+1 -> 9 | B12: MARTIN SANCHO, Mª JOSE | C12: SI | D12: x | E12: x | F12: x | G12: x | H12: x | I12: x | J12: x
A13: =SUM(A12)+1 -> 10 | B13: MOMPEAN OSUNA, JOSEP | C13: SI | D13: x | E13: x | F13: x | G13: x | H13: x | I13: x | J13: x
A14: =SUM(A13)+1 -> 11 | B14: ROMERO AGUILAR, MAITE | C14: SI | D14: x | E14: x | F14: x | G14: x | H14: x | I14: x | J14: x
A15: =SUM(A14)+1 -> 12 | B15: TARRAGONA CARLES, ARIADNA | C15: NO | D15: x | E15: x | F15: x | G15: x | H15: x | I15: x | J15: x
A16: =SUM(A15)+1 -> 13 | B16: TORRES MARTINEZ, CRISTINA | C16: SI | D16: x | E16: x | F16: x | G16: x | H16: x | I16: x | J16: x
A17: =SUM(A16)+1 -> 14 | B17: TRILLAS OLLÉ, ANTONI | C17: SI | D17: x | E17: x | F17: x | G17: x | H17: x | I17: x | J17: x
A18: =SUM(A17)+1 -> 15 | B18: VARELA IRIMIA, JOSÉ LUIS | C18: NO | D18: x | E18: x | F18: x | G18: x | H18: x | I18: x | J18: x
A19: =SUM(A18)+1 -> 16 | B19: VILLACAMPA LÓPEZ, BEATRIZ | C19: SI | D19: x | E19: x | F19: x | G19: x | H19: x | I19: x | J19: x
A20: =SUM(A19)+1 -> 17 | B20: MORENO, GERMAN | C20: NO | G20: x | H20: x
A21: =SUM(A20)+1 -> 18 | B21: TRULLOLS SOLER, ESTHER | C21: NO | H21: x | I21: x
A22: =SUM(A21)+1 -> 19 | B22: DOMÍNGUEZ SERRANO, F. JAVIER | C22: NO | F22: x | G22: x | I22: x
A23: =SUM(A22)+1 -> 20 | B23: SANTIAGO ZAMORA, SABINA | C23: NO | F23: x | G23: x | I23: x
A24: =SUM(A23)+1 -> 21 | B24: DOMÍNGUEZ SANTIAGO, GABRIEL | C24: NO | F24: x | G24: x | I24: x
A25: =SUM(A24)+1 -> 22 | B25: DOMÍNGUEZ SANTIAGO, ALMUDENA | C25: NO | F25: x | G25: x | I25: x
A26: =SUM(A25)+1 -> 23 | B26: HERNÁNDEZ, YOLANDA | C26: NO | G26: x | H26: x
A27: =SUM(A26)+1 -> 24 | B27: BOLAÑO, TERESA | C27: NO | G27: x
A28: =SUM(A27)+1 -> 25 | B28: ORDÓÑEZ, SEBASTIÁN | C28: NO | G28: x | H28: x
A29: =SUM(A28)+1 -> 26 | B29: CABÚS, M CLARA | C29: NO | G29: x
A30: =SUM(A29)+1 -> 27 | B30: RIOS, ELOI | C30: NO | G30: x