C2: ORIENTEERING URV 2Q 2012 - Resultats
C3: Practica 1 - PONT DEL DIABLE | I3: Entrenament 1 - PLATJA LLARGA
C4: 41020 | I4: 41023
D5: Hora sortida | E5: Hora arribada | F5: Temps | J5: Hora sortida | K5: Hora arribada | L5: Temps | M5: FAILS! | N5: CONTROL
B6: 1 | C6: MARTÍ ARMENGOL, ADRIA | D6: 0.42499999999999999 | E6: 0.45569444444444446 | F6: =E6-D6 -> 3.0694444444444469E-2 | H6: 1 | I6: DOMÍNGUEZ SERRANO, F. JAVIER | J6: 0.83333333333333337 | K6: 0.85133101851851845 | L6: =K6-J6 -> 1.7997685185185075E-2 | M6: 0
B7: =SUM(B6)+1 -> 2 | C7: TARRAGONA CARLES, ARIADNA | D7: 0.42499999999999999 | E7: 0.45569444444444446 | F7: =E7-D7 -> 3.0694444444444469E-2 | H7: =SUM(H6)+1 -> 2 | I7: DOMÍNGUEZ SANTIAGO, ALMUDENA | J7: 0.83333333333333337 | K7: 0.85133101851851845 | L7: =K7-J7 -> 1.7997685185185075E-2 | M7: 0
B8: =SUM(B7)+1 -> 3 | C8: DÓNIGA LASHERAS, PABLO | D8: 0.42604166666666665 | E8: 0.4604861111111111 | F8: =E8-D8 -> 3.4444444444444444E-2 | H8: =SUM(H7)+1 -> 3 | I8: CALVO AGUILAR, IRENE | J8: 0.83333333333333337 | K8: 0.85153935185185192 | L8: =K8-J8 -> 1.8206018518518552E-2 | M8: 0
B9: =SUM(B8)+1 -> 4 | C9: TRILLAS OLLÉ, ANTONI | D9: 0.42604166666666665 | E9: 0.46060185185185182 | F9: =E9-D9 -> 3.4560185185185166E-2 | H9: =SUM(H8)+1 -> 4 | I9: DURAN RUBIO, ELISABET | J9: 0.83333333333333337 | K9: 0.85160879629629627 | L9: =K9-J9 -> 1.8275462962962896E-2 | M9: 0
B10: =SUM(B9)+1 -> 5 | C10: GARCIA CIVIT, MARC | D10: 0.42430555555555555 | E10: 0.4614583333333333 | F10: =E10-D10 -> 3.7152777777777757E-2 | H10: =SUM(H9)+1 -> 5 | I10: MARTIN SANCHO, Mª JOSE | J10: 0.83333333333333337 | K10: 0.8520833333333333 | L10: =K10-J10 -> 1.8749999999999933E-2 | M10: 0
B11: =SUM(B10)+1 -> 6 | C11: LÓPEZ ESCRIU, IGNACIO | D11: 0.42430555555555555 | E11: 0.4614583333333333 | F11: =E11-D11 -> 3.7152777777777757E-2 | H11: =SUM(H10)+1 -> 6 | I11: LÓPEZ ESCRIU, IGNACIO | J11: 0.83333333333333337 | K11: 0.84432870370370372 | L11: =K11-J11 -> 1.099537037037035E-2 | M11: 1 | N11: 11
B12: =SUM(B11)+1 -> 7 | C12: DURAN RUBIO, ELISABET | D12: 0.42326388888888888 | E12: 0.46347222222222223 | F12: =E12-D12 -> 4.0208333333333346E-2 | H12: =SUM(H11)+1 -> 7 | I12: TRILLAS OLLÉ, ANTONI | J12: 0.83333333333333337 | K12: 0.84642361111111108 | L12: =K12-J12 -> 1.3090277777777715E-2 | M12: 1 | N12: 11
B13: =SUM(B12)+1 -> 8 | C13: VARELA IRIMIA, JOSÉ LUIS | D13: 0.42326388888888888 | E13: 0.46347222222222223 | F13: =E13-D13 -> 4.0208333333333346E-2 | H13: =SUM(H12)+1 -> 8 | I13: DÓNIGA LASHERAS, PABLO | J13: 0.83333333333333337 | K13: 0.84643518518518512 | L13: =K13-J13 -> 1.3101851851851753E-2 | M13: 1 | N13: 11
B14: =SUM(B13)+1 -> 9 | C14: DOMÍNGUEZ SERRANO, F. JAVIER | D14: 0.42708333333333331 | E14: 0.47342592592592592 | F14: =E14-D14 -> 4.6342592592592602E-2 | H14: =SUM(H13)+1 -> 9 | I14: CABÚS, M CLARA | J14: 0.83333333333333337 | K14: 0.84675925925925932 | L14: =K14-J14 -> 1.3425925925925952E-2 | M14: 1 | N14: 11
B15: =SUM(B14)+1 -> 10 | C15: DOMÍNGUEZ SANTIAGO, GABRIEL | D15: 0.42708333333333331 | E15: 0.47342592592592592 | F15: =E15-D15 -> 4.6342592592592602E-2 | H15: =SUM(H14)+1 -> 10 | I15: MARTÍ ARMENGOL, ADRIA | J15: 0.83333333333333337 | K15: 0.84732638888888889 | L15: =K15-J15 -> 1.3993055555555522E-2 | M15: 1 | N15: 11
B16: =SUM(B15)+1 -> 11 | C16: DOMÍNGUEZ SANTIAGO, ALMUDENA | D16: 0.42708333333333331 | E16: 0.47342592592592592 | F16: =E16-D16 -> 4.6342592592592602E-2 | H16: =SUM(H15)+1 -> 11 | I16: TARRAGONA CARLES, ARIADNA | J16: 0.83333333333333337 | K16: 0.84732638888888889 | L16: =K16-J16 -> 1.3993055555555522E-2 | M16: 1 | N16: 11
B17: =SUM(B16)+1 -> 12 | C17: SANTIAGO ZAMORA, SABINA | D17: 0.42708333333333331 | E17: 0.47342592592592592 | F17: =E17-D17 -> 4.6342592592592602E-2 | H17: =SUM(H16)+1 -> 12 | I17: VARELA IRIMIA, JOSÉ LUIS | J17: 0.83333333333333337 | K17: 0.85288194444444443 | L17: =K17-J17 -> 1.9548611111111058E-2 | M17: 1 | N17: 11
B18: =SUM(B17)+1 -> 13 | C18: ROMERO AGUILAR, MAITE | D18: 0.42222222222222222 | E18: 0.47638888888888892 | F18: =E18-D18 -> 5.4166666666666696E-2 | H18: =SUM(H17)+1 -> 13 | I18: GALLEGO PEREZ, ANGELA | J18: 0.83333333333333337 | K18: 0.8529282407407407 | L18: =K18-J18 -> 1.9594907407407325E-2 | M18: 1 | N18: 11
B19: =SUM(B18)+1 -> 14 | C19: VILLACAMPA LÓPEZ, BEATRIZ | D19: 0.42222222222222222 | E19: 0.47638888888888892 | F19: =E19-D19 -> 5.4166666666666696E-2 | H19: =SUM(H18)+1 -> 14 | I19: TORRES MARTINEZ, CRISTINA | J19: 0.83333333333333337 | K19: 0.85296296296296292 | L19: =K19-J19 -> 1.9629629629629552E-2 | M19: 1 | N19: 11
B20: =SUM(B19)+1 -> 15 | C20: CALVO AGUILAR, IRENE | D20: 0.42222222222222222 | E20: 0.45949074074074076 | F20: Error tarj. | H20: =SUM(H19)+1 -> 15 | I20: GARCIA CIVIT, MARC | J20: 0.83333333333333337 | K20: 0.844212962962963 | L20: =K20-J20 -> 1.0879629629629628E-2 | M20: 2 | N20: 11, 12
B21: =SUM(B20)+1 -> 16 | C21: FUENTES BENAVENTE, RAQUEL | D21: 0.4201388888888889 | E21: 0.47916666666666669 | F21: Error tarj. | H21: =SUM(H20)+1 -> 16 | I21: MOMPEAN OSUNA, JOSEP | J21: 0.83333333333333337 | K21: 0.84774305555555562 | L21: =K21-J21 -> 1.4409722222222254E-2 | M21: 2 | N21: 8, 11
B22: =SUM(B21)+1 -> 17 | C22: GALLEGO PEREZ, ANGELA | D22: 0.4201388888888889 | E22: 0.47916666666666669 | F22: Error tarj. | H22: =SUM(H21)+1 -> 17 | I22: ROMERO AGUILAR, MAITE | J22: 0.83333333333333337 | K22: 0.85055555555555562 | L22: =K22-J22 -> 1.722222222222225E-2 | M22: 2 | N22: 11, 12
B23: =SUM(B22)+1 -> 18 | C23: TORRES MARTINEZ, CRISTINA | D23: 0.4201388888888889 | E23: 0.47916666666666669 | F23: Error tarj. | H23: =SUM(H22)+1 -> 18 | I23: VILLACAMPA LÓPEZ, BEATRIZ | J23: 0.83333333333333337 | K23: 0.85056712962962966 | L23: =K23-J23 -> 1.7233796296296289E-2 | M23: 2 | N23: 11, 12
B24: =SUM(B23)+1 -> 19 | C24: MARTIN SANCHO, Mª JOSE | D24: 0.42326388888888888 | E24: 0.45949074074074076 | F24: Error tarj. | H24: =SUM(H23)+1 -> 19 | I24: FUENTES BENAVENTE, RAQUEL | J24: - | K24: - | L24: No surt
B25: =SUM(B24)+1 -> 20 | C25: MOMPEAN OSUNA, JOSEP | D25: - | E25: - | F25: No surt | H25: =SUM(H24)+1 -> 20 | I25: MORENO, GERMAN | J25: - | K25: - | L25: No surt
H26: =SUM(H25)+1 -> 21 | I26: SANTIAGO ZAMORA, SABINA | J26: - | K26: - | L26: No surt
H27: =SUM(H26)+1 -> 22 | I27: DOMÍNGUEZ SANTIAGO, GABRIEL | J27: - | K27: - | L27: No surt
H28: =SUM(H27)+1 -> 23 | I28: HERNÁNDEZ, YOLANDA | J28: - | K28: - | L28: No surt
H29: =SUM(H28)+1 -> 24 | I29: BOLAÑO, TERESA | J29: - | K29: - | L29: No surt
H30: =SUM(H29)+1 -> 25 | I30: ORDÓÑEZ, SEBASTIÁN | J30: - | K30: - | L30: No surt
H31: =SUM(H30)+1 -> 26 | I31: RIOS, ELOI | J31: - | K31: - | L31: No surt
C34: Puzzle - TARRAGONA PART ALTA
C35: 41025
D36: Hora sortida | E36: Hora arribada | F36: Temps
B37: 1 | C37: ORDÓÑEZ, SEBASTIÁN | D37: 4.8611111111111112E-3 | E37: 1.0208333333333333E-2 | F37: =E37-D37 -> 5.347222222222222E-3
B38: =SUM(B37)+1 -> 2 | C38: GARCIA CIVIT, MARC | D38: 3.472222222222222E-3 | E38: 1.1388888888888888E-2 | F38: =E38-D38 -> 7.9166666666666656E-3
B39: =SUM(B38)+1 -> 3 | C39: LÓPEZ ESCRIU, IGNACIO | D39: 2.7777777777777779E-3 | E39: 1.0937499999999999E-2 | F39: =E39-D39 -> 8.159722222222221E-3
B40: =SUM(B39)+1 -> 4 | C40: MARTÍ ARMENGOL, ADRIA | D40: 1.3888888888888889E-3 | E40: 1.0590277777777777E-2 | F40: =E40-D40 -> 9.2013888888888874E-3
B41: =SUM(B40)+1 -> 5 | C41: TRILLAS OLLÉ, ANTONI | D41: 6.9444444444444447E-4 | E41: 1.4120370370370368E-2 | F41: =E41-D41 -> 1.3425925925925924E-2
B42: =SUM(B41)+1 -> 6 | C42: ROMERO AGUILAR, MAITE | D42: 6.9444444444444447E-4 | E42: 1.4120370370370368E-2 | F42: =E42-D42 -> 1.3425925925925924E-2
B43: =SUM(B42)+1 -> 7 | C43: VARELA IRIMIA, JOSÉ LUIS | D43: 0 | E43: 1.5625E-2 | F43: =E43-D43 -> 1.5625E-2
B44: =SUM(B43)+1 -> 8 | C44: DÓNIGA LASHERAS, PABLO | D44: 4.1666666666666666E-3 | E44: 2.7905092592592592E-2 | F44: =E44-D44 -> 2.3738425925925927E-2
B45: =SUM(B44)+1 -> 9 | C45: FUENTES BENAVENTE, RAQUEL | D45: 3.472222222222222E-3 | E45: 3.0034722222222223E-2 | F45: =E45-D45 -> 2.6562499999999999E-2
B46: =SUM(B45)+1 -> 10 | C46: GALLEGO PEREZ, ANGELA | D46: 3.472222222222222E-3 | E46: 3.0034722222222223E-2 | F46: =E46-D46 -> 2.6562499999999999E-2
B47: =SUM(B46)+1 -> 11 | C47: DURAN RUBIO, ELISABET | D47: 2.0833333333333333E-3 | E47: 3.8194444444444441E-2 | F47: =E47-D47 -> 3.6111111111111108E-2
B48: =SUM(B47)+1 -> 12 | C48: MARTIN SANCHO, Mª JOSE | D48: 2.0833333333333333E-3 | E48: 3.8194444444444441E-2 | F48: =E48-D48 -> 3.6111111111111108E-2
B49: =SUM(B48)+1 -> 13 | C49: TARRAGONA CARLES, ARIADNA | D49: 1.3888888888888889E-3 | E49: 2.476851851851852E-2 | F49: Error tarj.
B50: =SUM(B49)+1 -> 14 | C50: TORRES MARTINEZ, CRISTINA | D50: - | E50: - | F50: No surt
B51: =SUM(B50)+1 -> 15 | C51: HERNÁNDEZ, YOLANDA | D51: - | E51: - | F51: No surt
B52: =SUM(B51)+1 -> 16 | C52: VILLACAMPA LÓPEZ, BEATRIZ | D52: - | E52: - | F52: No surt
B53: =SUM(B52)+1 -> 17 | C53: CALVO AGUILAR, IRENE | D53: - | E53: - | F53: No surt
B54: =SUM(B53)+1 -> 18 | C54: MOMPEAN OSUNA, JOSEP | D54: - | E54: - | F54: No surt
C58: Cursa model - PRADES
C59: 41029
D60: Hora sortida | E60: Hora arribada | F60: Temps
B61: 1 | C61: LÓPEZ ESCRIU, IGNACIO | D61: 0.60138888888888886 | E61: 0.63645833333333335 | F61: =E61-D61 -> 3.5069444444444486E-2
B62: =SUM(B61)+1 -> 2 | C62: VILLACAMPA LÓPEZ, BEATRIZ | D62: 0.59444444444444444 | E62: 0.64812499999999995 | F62: =E62-D62 -> 5.3680555555555509E-2
B63: =SUM(B62)+1 -> 3 | C63: MOMPEAN OSUNA, JOSEP | D63: 0.59444444444444444 | E63: 0.64812499999999995 | F63: =E63-D63 -> 5.3680555555555509E-2
B64: =SUM(B63)+1 -> 4 | C64: VARELA IRIMIA, JOSÉ LUIS | D64: 0.60763888888888895 | E64: 0.66135416666666669 | F64: =E64-D64 -> 5.3715277777777737E-2
B65: =SUM(B64)+1 -> 5 | C65: DÓNIGA LASHERAS, PABLO | D65: 0.60069444444444442 | E65: 0.66805555555555562 | F65: =E65-D65 -> 6.7361111111111205E-2
B66: =SUM(B65)+1 -> 6 | C66: ROMERO AGUILAR, MAITE | D66: 0.59722222222222221 | E66: 0.66597222222222219 | F66: =E66-D66 -> 6.8750000000000006E-2
B67: =SUM(B66)+1 -> 7 | C67: DOMÍNGUEZ SANTIAGO, ALMUDENA | D67: 0.6 | E67: 0.66909722222222223 | F67: =E67-D67 -> 6.9097222222222254E-2
B68: =SUM(B67)+1 -> 8 | C68: RODRÍGUEZ, DANI | D68: 0.59722222222222221 | E68: 0.66631944444444446 | F68: =E68-D68 -> 6.9097222222222254E-2
B69: =SUM(B68)+1 -> 9 | C69: DOMÍNGUEZ SERRANO, F. JAVIER | D69: 0.6 | E69: 0.66912037037037031 | F69: =E69-D69 -> 6.9120370370370332E-2
B70: =SUM(B69)+1 -> 10 | C70: FUENTES BENAVENTE, RAQUEL | D70: 0.59583333333333333 | E70: 0.66599537037037038 | F70: =E70-D70 -> 7.0162037037037051E-2
B71: =SUM(B70)+1 -> 11 | C71: TORRES MARTINEZ, CRISTINA | D71: 0.59583333333333333 | E71: 0.66608796296296291 | F71: =E71-D71 -> 7.0254629629629584E-2
B72: =SUM(B71)+1 -> 12 | C72: MARTÍ ARMENGOL, ADRIA | D72: 0.59930555555555554 | E72: 0.67256944444444444 | F72: =E72-D72 -> 7.3263888888888906E-2
B73: =SUM(B72)+1 -> 13 | C73: TARRAGONA CARLES, ARIADNA | D73: 0.58333333333333337 | E73: - | F73: Lesió
B74: =SUM(B73)+1 -> 14 | C74: TRILLAS OLLÉ, ANTONI | D74: - | E74: - | F74: No surt
B75: =SUM(B74)+1 -> 15 | C75: GARCIA CIVIT, MARC | D75: - | E75: - | F75: No surt
B76: =SUM(B75)+1 -> 16 | C76: DURAN RUBIO, ELISABET | D76: - | E76: - | F76: No surt
B77: =SUM(B76)+1 -> 17 | C77: DOMÍNGUEZ SANTIAGO, GABRIEL | D77: - | E77: - | F77: No surt
B78: =SUM(B77)+1 -> 18 | C78: SANTIAGO ZAMORA, SABINA | D78: - | E78: - | F78: No surt
B79: =SUM(B78)+1 -> 19 | C79: CALVO AGUILAR, IRENE | D79: - | E79: - | F79: No surt
B80: =SUM(B79)+1 -> 20 | C80: GALLEGO PEREZ, ANGELA | D80: - | E80: - | F80: No surt
B81: =SUM(B80)+1 -> 21 | C81: MARTIN SANCHO, Mª JOSE | D81: - | E81: - | F81: No surt

C2: Abril
B3: ASSISTÈNCIES | C3: TEÒRICA | D3: TEÒRICA | E3: PONTDIABLE | F3: VILANOVA | G3: PLATJA | H3: TARRAGONA | I3: PRADES
C4: 17 | D4: 19 | E4: 21 | F4: FIRAESPORT | G4: 24 | H4: 26 | I4: 28 | J4: Suma | K4: Estimació | L4: EXERCICI
B5: CALVO AGUILAR, IRENE | C5: 8.3333333333333329E-2 | D5: 8.3333333333333329E-2 | E5: 0.16666666666666666 | F5: 0.16666666666666666 | G5: 8.3333333333333329E-2 | H5: 4.1666666666666664E-2 | I5: FALTA | J5: =SUM(C5:I5) -> 0.625 | K5: 0.83333333333333337 | L5: ENTREGAT
B6: DÓNIGA LASHERAS, PABLO | C6: 8.3333333333333329E-2 | D6: 8.3333333333333329E-2 | E6: 0.16666666666666666 | F6: 0.16666666666666666 | G6: 8.3333333333333329E-2 | H6: 8.3333333333333329E-2 | I6: 0.16666666666666666 | J6: =SUM(C6:I6) -> 0.83333333333333337 | K6: 0.83333333333333337 | L6: ENTREGAT
B7: DURAN RUBIO, ELISABET | C7: 8.3333333333333329E-2 | D7: 8.3333333333333329E-2 | E7: 0.16666666666666666 | F7: 0.16666666666666666 | G7: 8.3333333333333329E-2 | H7: 8.3333333333333329E-2 | I7: FALTA | J7: =SUM(C7:I7) -> 0.66666666666666674 | K7: 0.83333333333333337 | L7: ENTREGAT
B8: FUENTES BENAVENTE, RAQUEL | C8: 8.3333333333333329E-2 | D8: 8.3333333333333329E-2 | E8: 0.16666666666666666 | F8: FALTA | G8: FALTA | H8: 8.3333333333333329E-2 | I8: 0.16666666666666666 | J8: =SUM(C8:I8) -> 0.58333333333333326 | K8: 0.83333333333333337 | L8: ENTREGAT
B9: GALLEGO PEREZ, ANGELA | C9: 8.3333333333333329E-2 | D9: 8.3333333333333329E-2 | E9: 0.16666666666666666 | F9: 0.16666666666666666 | G9: 8.3333333333333329E-2 | H9: 8.3333333333333329E-2 | I9: FALTA | J9: =SUM(C9:I9) -> 0.66666666666666674 | K9: 0.83333333333333337 | L9: ENTREGAT
B10: GARCIA CIVIT, MARC | C10: 8.3333333333333329E-2 | D10: 8.3333333333333329E-2 | E10: 0.16666666666666666 | F10: 0.16666666666666666 | G10: 8.3333333333333329E-2 | H10: 8.3333333333333329E-2 | I10: 0.16666666666666666 | J10: =SUM(C10:I10) -> 0.83333333333333337 | K10: - | L10: ENTREGAT
B11: LÓPEZ ESCRIU, IGNACIO | C11: 8.3333333333333329E-2 | D11: 8.3333333333333329E-2 | E11: 0.16666666666666666 | F11: 0.16666666666666666 | G11: 8.3333333333333329E-2 | H11: 8.3333333333333329E-2 | I11: 0.16666666666666666 | J11: =SUM(C11:I11) -> 0.83333333333333337 | K11: 0.83333333333333337 | L11: ENTREGAT
B12: MARTÍ ARMENGOL, ADRIA | C12: 8.3333333333333329E-2 | D12: 8.3333333333333329E-2 | E12: 0.16666666666666666 | F12: 0.16666666666666666 | G12: 8.3333333333333329E-2 | H12: 8.3333333333333329E-2 | I12: 0.16666666666666666 | J12: =SUM(C12:I12) -> 0.83333333333333337 | K12: 0.83333333333333337 | L12: ENTREGAT
B13: MARTIN SANCHO, Mª JOSE | C13: 8.3333333333333329E-2 | D13: 8.3333333333333329E-2 | E13: 0.16666666666666666 | F13: 0.16666666666666666 | G13: 8.3333333333333329E-2 | H13: 8.3333333333333329E-2 | I13: FALTA | J13: =SUM(C13:I13) -> 0.66666666666666674 | K13: 0.83333333333333337 | L13: ENTREGAT
B14: MOMPEAN OSUNA, JOSEP | C14: 8.3333333333333329E-2 | D14: 8.3333333333333329E-2 | E14: FALTA | F14: 0.16666666666666666 | G14: 8.3333333333333329E-2 | H14: 4.1666666666666664E-2 | I14: 0.16666666666666666 | J14: =SUM(C14:I14) -> 0.625 | K14: 0.83333333333333337 | L14: ENTREGAT
B15: ROMERO AGUILAR, MAITE | C15: 8.3333333333333329E-2 | D15: 8.3333333333333329E-2 | E15: 0.16666666666666666 | F15: 0.16666666666666666 | G15: 8.3333333333333329E-2 | H15: 8.3333333333333329E-2 | I15: 0.16666666666666666 | J15: =SUM(C15:I15) -> 0.83333333333333337 | K15: 0.83333333333333337 | L15: ENTREGAT
B16: TARRAGONA CARLES, ARIADNA | C16: 8.3333333333333329E-2 | D16: 8.3333333333333329E-2 | E16: 0.16666666666666666 | F16: 0.16666666666666666 | G16: 8.3333333333333329E-2 | H16: 8.3333333333333329E-2 | I16: 0.16666666666666666 | J16: =SUM(C16:I16) -> 0.83333333333333337 | K16: - | L16: -
B17: TORRES MARTINEZ, CRISTINA | C17: 8.3333333333333329E-2 | D17: FALTA | E17: 0.16666666666666666 | F17: 0.16666666666666666 | G17: 8.3333333333333329E-2 | H17: FALTA | I17: 0.16666666666666666 | J17: =SUM(C17:I17) -> 0.66666666666666663 | K17: 0.83333333333333337 | L17: ENTREGAT
B18: TRILLAS OLLÉ, ANTONI | C18: 8.3333333333333329E-2 | D18: 8.3333333333333329E-2 | E18: 0.16666666666666666 | F18: 0.16666666666666666 | G18: 8.3333333333333329E-2 | H18: 8.3333333333333329E-2 | I18: FALTA | J18: =SUM(C18:I18) -> 0.66666666666666674 | K18: 0.83333333333333337 | L18: ENTREGAT
B19: VARELA IRIMIA, JOSÉ LUIS | C19: 8.3333333333333329E-2 | D19: 8.3333333333333329E-2 | E19: 0.16666666666666666 | F19: 0.16666666666666666 | G19: 8.3333333333333329E-2 | H19: 8.3333333333333329E-2 | I19: 0.16666666666666666 | J19: =SUM(C19:I19) -> 0.83333333333333337 | K19: - | L19: -
B20: VILLACAMPA LÓPEZ, BEATRIZ | C20: 8.3333333333333329E-2 | D20: 8.3333333333333329E-2 | E20: 0.16666666666666666 | F20: 0.16666666666666666 | G20: 8.3333333333333329E-2 | H20: FALTA | I20: 0.16666666666666666 | J20: =SUM(C20:I20) -> 0.75 | K20: 0.83333333333333337 | L20: ENTREGAT
B22: MARTIN SANCHO, Mª JOSE | C22: 4:00:00* | D22: CONVALIDAT