B3: SUMES
C4: BUCLE 1 | D4: BUCLE 2 | E4: BUCLE 3 | F4: BUCLE 4 | G4: BUCLE 5 | H4: BUCLE 6 | I4: TOTAL | J4: Temps
B5: FIBLA SIMÓ, MONTSE | C5: 8 | D5: 11 | E5: 16 | F5: 5 | G5: 12 | H5: 9 | I5: =SUM(C5:H5) -> 61 | J5: 0.48958333333333331
B6: SOBRERO, GLÒRIA | C6: 8 | D6: 9 | E6: 5 | F6: 2 | G6: 8 | H6: 7 | I6: =SUM(C6:H6) -> 39 | J6: 1.1493055555555556
B7: YEPES RODA, MARIBEL | C7: 8 | I7: =SUM(C7:H7) -> 8 | J7: 0.48958333333333331
B8: VARGAS FUENTES, CRISA | C8: 9 | D8: 8 | E8: 9 | F8: 7 | G8: 8 | H8: 15 | I8: =SUM(C8:H8) -> 56 | J8: 0.48958333333333331
B9: MARIO ANDRÉS ALONSO RODRÍGUEZ | C9: 8 | I9: =SUM(C9:H9) -> 8 | J9: 0.90972222222222221
B10: DÍDAC BANÚS BRUNET | C10: 8 | I10: =SUM(C10:H10) -> 8 | J10: 0.90972222222222221
B11: ALBA CABALLE SANCHEZ | C11: 8 | D11: 7 | E11: 5 | F11: 6 | G11: 14 | H11: 9 | I11: =SUM(C11:H11) -> 49 | J11: Error targeta
B12: JOAN MARIA IDIARTE MARGALEF | C12: 8 | D12: 11 | E12: 16 | F12: 8 | G12: 12 | H12: 9 | I12: =SUM(C12:H12) -> 64 | J12: Error targeta
B13: MARC RAMON VIDAL | C13: 8 | D13: 7 | E13: 5 | F13: 6 | G13: 14 | H13: 9 | I13: =SUM(C13:H13) -> 49 | J13: Error targeta
B14: IRAIDA SOUSA GAS | C14: 8 | D14: 11 | E14: 16 | F14: 8 | G14: 12 | H14: 9 | I14: =SUM(C14:H14) -> 64 | J14: 1.1493055555555556
B15: IZHAR TORRES MARCUELLO | I15: =SUM(C15:H15) -> 0 | J15: no sale
B16: MONTSERRAT CODINA ESTEBAN | C16: 8 | I16: =SUM(C16:H16) -> 8 | J16: 0.90972222222222221