C2: ORIENTEERING URV 1Q 2012-13 Resultats
C3: "La prenda" - PLATJA LLARGA | I3: CLASSIFICACIÓ GENERAL
C4: 41198
D5: Nº de controls | E5: Arribada | F5: Puntuació | J5: La prenda | K5: Puzzle | L5: Segalassos | M5: El Catllar | N5: Sescelades | O5: TOTAL
B6: 1 | C6: DÍDAC BANÚS BRUNET | D6: 4 | E6: 1 | F6: 100 | H6: 1 | I6: DÍDAC BANÚS BRUNET | J6: 100 | K6: 100 | L6: 100 | M6: 100 | O6: =SUM(J6:N6) -> 400
B7: =SUM(B6)+1 -> 2 | C7: MONTSERRAT CODINA ESTEBAN | D7: 4 | E7: 1 | F7: 100 | H7: =SUM(H6)+1 -> 2 | I7: MONTSERRAT CODINA ESTEBAN | J7: 100 | K7: 95 | L7: 100 | M7: - | O7: =SUM(J7:N7) -> 295
B8: =SUM(B7)+1 -> 3 | C8: FIBLA SIMÓ, MONTSE | D8: 3 | E8: 2 | F8: 95 | H8: =SUM(H7)+1 -> 3 | I8: FIBLA SIMÓ, MONTSE | J8: 95 | K8: 100 | L8: 100 | M8: - | O8: =SUM(J8:N8) -> 295
B9: =SUM(B8)+1 -> 4 | C9: YEPES RODA, MARIBEL | D9: 3 | E9: 2 | F9: 95 | H9: =SUM(H8)+1 -> 4 | I9: IZHAR TORRES MARCUELLO | J9: 90 | K9: - | L9: 100 | M9: 100 | O9: =SUM(J9:N9) -> 290
B10: =SUM(B9)+1 -> 5 | C10: VARGAS FUENTES, CRISA | D10: 3 | E10: 2 | F10: 95 | H10: =SUM(H9)+1 -> 5 | I10: YEPES RODA, MARIBEL | J10: 95 | K10: 100 | L10: - | M10: - | O10: =SUM(J10:N10) -> 195
B11: =SUM(B10)+1 -> 6 | C11: MARIO ANDRÉS ALONSO RODRÍGUEZ | D11: 3 | E11: 3 | F11: 95 | H11: =SUM(H10)+1 -> 6 | I11: VARGAS FUENTES, CRISA | J11: 95 | K11: 100 | L11: - | M11: - | O11: =SUM(J11:N11) -> 195
B12: =SUM(B11)+1 -> 7 | C12: IZHAR TORRES MARCUELLO | D12: 3 | E12: 3 | F12: 90 | H12: =SUM(H11)+1 -> 7 | I12: MARIO ANDRÉS ALONSO RODRÍGUEZ | J12: 95 | K12: 100 | L12: - | M12: - | O12: =SUM(J12:N12) -> 195
B13: =SUM(B12)+1 -> 8 | C13: SOBRERO, GLÒRIA | D13: 3 | E13: 4 | F13: 85 | H13: =SUM(H12)+1 -> 8 | I13: SOBRERO, GLÒRIA | J13: 85 | K13: 90 | L13: - | M13: - | O13: =SUM(J13:N13) -> 175
B14: =SUM(B13)+1 -> 9 | C14: IRAIDA SOUSA GAS | D14: 3 | E14: 4 | F14: 85 | H14: =SUM(H13)+1 -> 9 | I14: IRAIDA SOUSA GAS | J14: 85 | K14: 85 | L14: - | M14: - | O14: =SUM(J14:N14) -> 170
B15: =SUM(B14)+1 -> 10 | C15: ALBA CABALLE SANCHEZ | D15: - | E15: - | F15: - | H15: =SUM(H14)+1 -> 10 | I15: ALBA CABALLE SANCHEZ | J15: - | K15: - | L15: - | M15: - | O15: =SUM(J15:N15) -> 0
B16: =SUM(B15)+1 -> 11 | C16: JOAN MARIA IDIARTE MARGALEF | D16: - | E16: - | F16: - | H16: =SUM(H15)+1 -> 11 | I16: JOAN MARIA IDIARTE MARGALEF | J16: - | K16: - | L16: - | M16: - | O16: =SUM(J16:N16) -> 0
B17: =SUM(B16)+1 -> 12 | C17: MARC RAMON VIDAL | D17: - | E17: - | F17: - | H17: =SUM(H16)+1 -> 12 | I17: MARC RAMON VIDAL | J17: - | K17: - | L17: - | M17: - | O17: =SUM(J17:N17) -> 0
C20: Puzzle - Part alta
C21: 41200
D22: Temps | E22: Puntuació
B23: 1 | C23: FIBLA SIMÓ, MONTSE | D23: 0.48958333333333331 | E23: 100
B24: =SUM(B23)+1 -> 2 | C24: YEPES RODA, MARIBEL | D24: 0.48958333333333331 | E24: 100
B25: =SUM(B24)+1 -> 3 | C25: VARGAS FUENTES, CRISA | D25: 0.48958333333333331 | E25: 100
B26: =SUM(B25)+1 -> 4 | C26: DÍDAC BANÚS BRUNET | D26: 0.90972222222222221 | E26: 100
B27: =SUM(B26)+1 -> 5 | C27: MONTSERRAT CODINA ESTEBAN | D27: 0.90972222222222221 | E27: 95
B28: =SUM(B27)+1 -> 6 | C28: MARIO ANDRÉS ALONSO RODRÍGUEZ | D28: 0.90972222222222221 | E28: 100
B29: =SUM(B28)+1 -> 7 | C29: SOBRERO, GLÒRIA | D29: 1.1493055555555556 | E29: 90
B30: =SUM(B29)+1 -> 8 | C30: IRAIDA SOUSA GAS | D30: 1.1493055555555556 | E30: 85
B31: =SUM(B30)+1 -> 9 | C31: ALBA CABALLE SANCHEZ | D31: Error targeta | E31: -
B32: =SUM(B31)+1 -> 10 | C32: JOAN MARIA IDIARTE MARGALEF | D32: Error targeta | E32: -
B33: =SUM(B32)+1 -> 11 | C33: MARC RAMON VIDAL | D33: Error targeta | E33: -
B34: =SUM(B33)+1 -> 12 | C34: IZHAR TORRES MARCUELLO | D34: no sale | E34: -
C37: Segalassos
C38: 41209
D39: Temps | E39: Puntuació
B40: 1 | C40: FIBLA SIMÓ, MONTSE | D40: 2.9976851851851852E-2 | E40: 100
B41: =SUM(B40)+1 -> 2 | C41: DÍDAC BANÚS BRUNET | D41: 2.9976851851851852E-2 | E41: 100
B42: =SUM(B41)+1 -> 3 | C42: MONTSERRAT CODINA ESTEBAN | D42: 2.9976851851851852E-2 | E42: 100
B43: =SUM(B42)+1 -> 4 | C43: IZHAR TORRES MARCUELLO | D43: 2.9976851851851852E-2 | E43: 100
B44: =SUM(B43)+1 -> 5 | C44: YEPES RODA, MARIBEL | D44: - | E44: -
B45: =SUM(B44)+1 -> 6 | C45: VARGAS FUENTES, CRISA | D45: - | E45: -
B46: =SUM(B45)+1 -> 7 | C46: SOBRERO, GLÒRIA | D46: 3 errors | E46: -
B47: =SUM(B46)+1 -> 8 | C47: IRAIDA SOUSA GAS | D47: 3 errors | E47: -
B48: =SUM(B47)+1 -> 9 | C48: MARIO ANDRÉS ALONSO RODRÍGUEZ | D48: 4 errors | E48: -
B49: =SUM(B48)+1 -> 10 | C49: ALBA CABALLE SANCHEZ | D49: 5 errors | E49: -
B50: =SUM(B49)+1 -> 11 | C50: JOAN MARIA IDIARTE MARGALEF | D50: 5 errors | E50: -
B51: =SUM(B50)+1 -> 12 | C51: MARC RAMON VIDAL | D51: 5 errors | E51: -
C54: El Catllar
C55: 41205
D56: Sortida | E56: Arribada | F56: Temps
B57: 1 | C57: DÍDAC BANÚS BRUNET | D57: 0.7895833333333333 | E57: 0.83027777777777778 | F57: 2.9976851851851852E-2 | H57: 100
B58: =SUM(B57)+1 -> 2 | C58: IZHAR TORRES MARCUELLO | D58: 0.7895833333333333 | E58: 0.83027777777777778 | F58: 2.9976851851851852E-2 | H58: 100
B59: =SUM(B58)+1 -> 3 | C59: FIBLA SIMÓ, MONTSE | D59: 0.7909722222222223 | E59: 0.82581018518518512 | F59: 4 errors
B60: =SUM(B59)+1 -> 4 | C60: YEPES RODA, MARIBEL | D60: 0.7909722222222223 | E60: 0.82581018518518512 | F60: 4 errors
B61: =SUM(B60)+1 -> 5 | C61: VARGAS FUENTES, CRISA | D61: 0.7909722222222223 | E61: 0.82581018518518512 | F61: 4 errors
B62: =SUM(B61)+1 -> 6 | C62: MARIO ANDRÉS ALONSO RODRÍGUEZ | D62: 0.7895833333333333 | E62: 0.82650462962962967 | F62: 4 errors
B63: =SUM(B62)+1 -> 7 | C63: ALBA CABALLE SANCHEZ | D63: 0.7895833333333333 | E63: 0.82650462962962967 | F63: 4 errors
B64: =SUM(B63)+1 -> 8 | C64: MARC RAMON VIDAL | D64: 0.7895833333333333 | E64: 0.82650462962962967 | F64: 4 errors
B65: =SUM(B64)+1 -> 9 | C65: JOAN MARIA IDIARTE MARGALEF | D65: 0.7895833333333333 | E65: 0.82650462962962967 | F65: 4 errors
B66: =SUM(B65)+1 -> 10 | C66: MONTSERRAT CODINA ESTEBAN | D66: - | E66: - | F66: -
B67: =SUM(B66)+1 -> 11 | C67: SOBRERO, GLÒRIA | D67: 0.48958333333333331 | E67: - | F67: -
B68: =SUM(B67)+1 -> 12 | C68: IRAIDA SOUSA GAS | D68: 0.48958333333333331 | E68: - | F68: -