C2: Octubre
B3: ASSISTÈNCIES | C3: TEÒRICA | D3: TEÒRICA | E3: PLATJA | F3: TARRAGONA | G3: PLATJA | H3: TARRAGONA | I3: PRADES | J3: SESCELADES
C4: 9 | D4: 11 | E4: 16 | F4: 18 | G4: 23 | H4: 25 | I4: 28 | J4: 9 | K4: Suma | L4: Estimació | M4: EXERCICI
B5: FIBLA SIMÓ, MONTSE | C5: 8.3333333333333329E-2 | D5: 8.3333333333333329E-2 | E5: 8.3333333333333329E-2 | F5: 8.3333333333333329E-2 | G5: 8.3333333333333329E-2 | H5: 8.3333333333333329E-2 | I5: 0.27083333333333331 | K5: =SUM(C5:J5) -> 0.77083333333333326 | L5: 25 hores
B6: SOBRERO, GLÒRIA | C6: 8.3333333333333329E-2 | D6: FALTA | E6: 8.3333333333333329E-2 | F6: 8.3333333333333329E-2 | G6: 8.3333333333333329E-2 | H6: 8.3333333333333329E-2 | I6: 0.27083333333333331 | K6: =SUM(C6:J6) -> 0.6875 | L6: 25 hores
B7: YEPES RODA, MARIBEL | C7: 8.3333333333333329E-2 | D7: 8.3333333333333329E-2 | E7: 8.3333333333333329E-2 | F7: 8.3333333333333329E-2 | G7: 8.3333333333333329E-2 | H7: 8.3333333333333329E-2 | I7: FALTA | K7: =SUM(C7:J7) -> 00.5 | L7: 25 hores
B8: VARGAS FUENTES, CRISA | C8: 8.3333333333333329E-2 | D8: 8.3333333333333329E-2 | E8: 8.3333333333333329E-2 | F8: 8.3333333333333329E-2 | G8: 8.3333333333333329E-2 | H8: 8.3333333333333329E-2 | I8: FALTA | K8: =SUM(C8:J8) -> 00.5 | L8: 25 hores
B9: MARIO ANDRÉS ALONSO RODRÍGUEZ | C9: 8.3333333333333329E-2 | D9: 8.3333333333333329E-2 | E9: 8.3333333333333329E-2 | F9: 8.3333333333333329E-2 | G9: 8.3333333333333329E-2 | H9: 8.3333333333333329E-2 | I9: 0.27083333333333331 | K9: =SUM(C9:J9) -> 0.77083333333333326 | L9: 25 hores
B10: DÍDAC BANÚS BRUNET | C10: 8.3333333333333329E-2 | D10: 8.3333333333333329E-2 | E10: 8.3333333333333329E-2 | F10: 8.3333333333333329E-2 | G10: 8.3333333333333329E-2 | H10: 8.3333333333333329E-2 | I10: 0.27083333333333331 | K10: =SUM(C10:J10) -> 0.77083333333333326 | L10: 25 hores
B11: ALBA CABALLE SANCHEZ | C11: 8.3333333333333329E-2 | D11: 8.3333333333333329E-2 | E11: FALTA | F11: 8.3333333333333329E-2 | G11: 8.3333333333333329E-2 | H11: FALTA | I11: 0.27083333333333331 | K11: =SUM(C11:J11) -> 0.60416666666666663 | L11: 25 hores
B12: JOAN MARIA IDIARTE MARGALEF | C12: 8.3333333333333329E-2 | D12: 8.3333333333333329E-2 | E12: FALTA | F12: 8.3333333333333329E-2 | G12: 8.3333333333333329E-2 | H12: FALTA | I12: 0.27083333333333331 | K12: =SUM(C12:J12) -> 0.60416666666666663 | L12: 25 hores
B13: MARC RAMON VIDAL | C13: 8.3333333333333329E-2 | D13: 8.3333333333333329E-2 | E13: FALTA | F13: 8.3333333333333329E-2 | G13: 8.3333333333333329E-2 | H13: FALTA | I13: 0.27083333333333331 | K13: =SUM(C13:J13) -> 0.60416666666666663 | L13: 25 hores
B14: IRAIDA SOUSA GAS | C14: 8.3333333333333329E-2 | D14: 8.3333333333333329E-2 | E14: 8.3333333333333329E-2 | F14: 8.3333333333333329E-2 | G14: 8.3333333333333329E-2 | H14: 8.3333333333333329E-2 | I14: 0.27083333333333331 | K14: =SUM(C14:J14) -> 0.77083333333333326 | L14: 25 hores
B15: IZHAR TORRES MARCUELLO | C15: 8.3333333333333329E-2 | D15: 8.3333333333333329E-2 | E15: 8.3333333333333329E-2 | F15: FALTA | G15: 8.3333333333333329E-2 | H15: 8.3333333333333329E-2 | I15: 0.27083333333333331 | K15: =SUM(C15:J15) -> 0.6875 | L15: 25 hores
B16: MONTSERRAT CODINA ESTEBAN | C16: 8.3333333333333329E-2 | D16: 8.3333333333333329E-2 | E16: 8.3333333333333329E-2 | F16: 8.3333333333333329E-2 | G16: FALTA | H16: 8.3333333333333329E-2 | I16: 0.27083333333333331 | K16: =SUM(C16:J16) -> 0.6875 | L16: 25 hores