B3: LLISTAT DEFINITIU D'INSCRITS
B5: 1er COGNOM | C5: 2n COGNOM | D5: NOM | E5: Club | F5: GRUP | G5: QUOTA
A6: 1 | B6: FEIJOO | C6: RODRIGUEZ | D6: SERGI | E6: Montsant | F6: A | G6: 1
A7: = A6 + 1 -> 2 | B7: Rios | C7: Vallvè | D7: Eloi | E7: Montsant | F7: A | G7: 1
A8: = A7 + 1 -> 3 | B8: Bolaño | C8: Guivernau | D8: Teresa | E8: Montsant | F8: A | G8: 1
A9: = A8 + 1 -> 4 | B9: Roca | C9: Vallverdú | D9: Cèsar | E9: Montsant | F9: A | G9: 1
A10: = A9 + 1 -> 5 | B10: Xell | C10: Vives | D10: Torrents | E10: Montsant | F10: A | G10: 1*
A11: = A10 + 1 -> 6 | B11: Pep | C11: Nogués | D11: Llevat | E11: Montsant | F11: A | G11: 1*
A12: = A11 + 1 -> 7 | B12: MATA | C12: MEDINA | D12: JUDIT | E12: Montsant | F12: A | G12: 1
A13: = A12 + 1 -> 8 | B13: DELGADO | C13: MORANT | D13: LOLI | E13: Montsant | F13: A | G13: 1
A14: = A13 + 1 -> 9 | B14: CORGNET | C14: X | D14: NICOLAS | E14: Montsant | F14: A | G14: 2 i 3
A15: = A14 + 1 -> 10 | B15: Solé | C15: Boronat | D15: Gemma | E15: Montsant | F15: A | G15: 1
A16: = A15 + 1 -> 11 | B16: ROSICH | C16: RIBAS | D16: ELOI | E16: Montsant | F16: A | G16: 1
A17: = A16 + 1 -> 12 | B17: Redondo | C17: Brunet | D17: Anna | E17: Montsant | F17: B | G17: 1
A18: = A17 + 1 -> 13 | B18: Báscones | C18: Huertas | D18: José Luis | E18: Rumbo | F18: B | G18: 3
A19: = A18 + 1 -> 14 | B19: CABÚS | C19: LLAURADÓ | D19: M. CLARA | E19: Montsant | F19: B | G19: S 1, 2 i 3
A20: = A19 + 1 -> 15 | B20: ANGUERA | C20: MARTÍNEZ | D20: MÒNICA | E20: Montsant | F20: B | G20: S 1, 2 i 3
A21: = A20 + 1 -> 16 | B21: TRULLOLS | C21: SOLER | D21: ESTHER | E21: Montsant | F21: B | G21: S 1, 2 i 3
A22: = A21 + 1 -> 17 | B22: Pinyol | C22: Castro | D22: Benet | E22: Montsant | F22: B | G22: 1
A23: = A22 + 1 -> 18 | B23: Figueras | C23: Anton | D23: Alfred | E23: Montsant | F23: C | G23: 1
A24: = A23 + 1 -> 19 | B24: Pérez | C24: Griso | D24: Gerard | E24: Montsant | F24: C | G24: 1
A25: = A24 + 1 -> 20 | B25: Pérez | C25: Griso | D25: Núria | E25: Montsant | F25: C | G25: 1
A26: = A25 + 1 -> 21 | B26: Roca | C26: Redondo | D26: Aida | E26: Montsant | F26: C | G26: 1
A27: = A26 + 1 -> 22 | B27: VIRGILI | C27: VIDAL | D27: GEMMA | E27: Montsant | F27: C | G27: 1
A28: = A27 + 1 -> 23 | B28: Pinyol | C28: Barrios | D28: Adrià | E28: Montsant | F28: C | G28: 1
A29: = A28 + 1 -> 24 | B29: SUMOY | C29: ROVIRA | D29: XÈNIA | E29: Montsant | F29: C | G29: 1
A30: = A29 + 1 -> 25 | B30: Ravell | C30: Solé | D30: Judit | E30: Montsant | F30: C | G30: 1
A31: = A30 + 1 -> 26 | B31: Sanz | C31: Drudis | D31: Marc | E31: - | F31: C | G31: 3
A32: = A31 + 1 -> 27 | B32: OLIVIER | C32: TEXIER | D32: YANN LUCA | E32: Montsant | F32: C | G32: 2 i 3
A33: = A32 + 1 -> 28 | B33: MASSOT | C33: ADELL | D33: BLANCA | E33: - | G33: 4
A34: = A33 + 1 -> 29 | B34: FEIJOO | C34: MASSOT | D34: ROC | E34: Montsant | G34: 4
A35: = A34 + 1 -> 30 | B35: FEIJOO | C35: MASSOT | D35: ROGER | E35: Montsant | G35: 4
B37: ** Obligatori disposar d'assegurança esportiva. En cas de estar federat tramitarem l'assegurança d'un dia (3€/dia). Llicència FEEC C o superior acceptada.