B3: RESULTATS CURSA MODEL DIUMENGE
B5: 1er COGNOM | C5: 2n COGNOM | D5: NOM | E5: Club | F5: Circuit | G5: Temps
A6: 1 | B6: CORGNET | C6: X | D6: NICOLAS | E6: Montsant | F6: A | G6: 00:50:00
A7: = A6 + 1 -> 2 | B7: Rios | C7: Vallvè | D7: Eloi | E7: Montsant | F7: A | G7: 00:50:18
A8: = A7 + 1 -> 3 | B8: FEIJOO | C8: RODRIGUEZ | D8: SERGI | E8: Montsant | F8: A | G8: 00:51:10
A9: = A8 + 1 -> 4 | B9: Figueras | C9: Anton | D9: Alfred | E9: Montsant | F9: A | G9: 01:10:00
A10: = A9 + 1 -> 5 | B10: Bolaño | C10: Guivernau | D10: Teresa | E10: Montsant | F10: A | G10: mp
A11: = A10 + 1 -> 6 | B11: Roca | C11: Vallverdú | D11: Cèsar | E11: Montsant | F11: A | G11: mp
A12: = A11 + 1 -> 7 | B12: Pep | C12: Nogués | D12: Llevat | E12: Montsant | F12: A | G12: mp
A13: = A12 + 1 -> 8 | B13: MATA | C13: MEDINA | D13: JUDIT | E13: Montsant | F13: A | G13: mp
A14: = A13 + 1 -> 9 | B14: ROSICH | C14: RIBAS | D14: ELOI | E14: Montsant | F14: A | G14: mp
A15: = A14 + 1 -> 10 | B15: Pérez | C15: Griso | D15: Gerard | E15: Montsant | F15: A | G15: mp
A17: 1 | B17: OLIVIER | C17: TEXIER | D17: YANN LUCA | E17: Montsant | F17: B | G17: 00:49:00
A18: = A17 + 1 -> 2 | B18: Xell | C18: Vives | D18: Torrents | E18: Montsant | F18: B | G18: 00:50:00
A19: = A18 + 1 -> 3 | B19: Sanz | C19: Drudis | D19: Marc | E19: - | F19: B | G19: 00:50:00
A20: = A19 + 1 -> 4 | B20: Pinyol | C20: Barrios | D20: Adrià | E20: Montsant | F20: B | G20: 00:56:00
A21: = A20 + 1 -> 5 | B21: DELGADO | C21: MORANT | D21: LOLI | E21: Montsant | F21: B | G21: 01:10:00
A22: = A21 + 1 -> 6 | B22: Pinyol | C22: Castro | D22: Benet | E22: Montsant | F22: B | G22: 01:20:00
A23: = A22 + 1 -> 7 | B23: Báscones | C23: Huertas | D23: José Luis | E23: Rumbo | F23: B | G23: 01:21:00
A24: = A23 + 1 -> 8 | B24: Pérez | C24: Griso | D24: Núria | E24: Montsant | F24: B | G24: mp
A25: = A24 + 1 -> 9 | B25: VIRGILI | C25: VIDAL | D25: GEMMA | E25: Montsant | F25: B | G25: mp
A26: = A25 + 1 -> 10 | B26: SUMOY | C26: ROVIRA | D26: XÈNIA | E26: Montsant | F26: B | G26: mp
A27: = A26 + 1 -> 11 | B27: Roca | C27: Redondo | D27: Aida | E27: Montsant | F27: B | G27: No surt