C2: ORIENTEERING URV 2Q 2012-13 Resultats
C3: "La prenda" - PONT DEL DIABLE | J3: CLASSIFICACIÓ DEFINITIVA (puntuen les 4 millors curses)
C4: 41373
F5: Nº de controls | G5: Puntuació | J5: Nom | K5: Congom 1 | L5: Cognom 2 | M5: Pont diable | N5: Catllar | O5: Tarragona | P5: El Vendrell | Q5: Platja Llarga | R5: TOTAL
B6: 1 | C6: Robert | D6: Bergé | E6: Sarroca | F6: 5 | G6: 100 | I6: 1 | J6: Andreu | K6: Blanch | L6: Bargalló | M6: 100 | N6: 95 | P6: 90 | R6: =SUM(M6:Q6) -> 285
B7: =SUM(B6)+1 -> 2 | C7: Andreu | D7: Blanch | E7: Bargalló | F7: 5 | G7: 100 | I7: =SUM(I6)+1 -> 2 | J7: Gerard | K7: Feliu | L7: Cendra | M7: 90 | N7: 90 | Q7: 100 | R7: =SUM(M7:Q7) -> 280
B8: =SUM(B7)+1 -> 3 | C8: Marc | D8: Moreno | E8: Gené | F8: 5 | G8: 100 | I8: =SUM(I7)+1 -> 3 | J8: Jaume | K8: Fabregat | L8: González | M8: 90 | N8: 100 | O8: 85 | R8: =SUM(M8:Q8) -> 275
B9: =SUM(B8)+1 -> 4 | C9: Eduard | D9: Ingles | E9: Monteiro | F9: 5 | G9: 100 | I9: =SUM(I8)+1 -> 4 | J9: Sergio | K9: Cortijo | L9: Jiménez | M9: 95 | O9: 95 | P9: 70 | R9: =SUM(M9:Q9) -> 260
B10: =SUM(B9)+1 -> 5 | C10: Carles | D10: Sienes | E10: Pepio | F10: 5 | G10: 100 | I10: =SUM(I9)+1 -> 5 | J10: Narcís | K10: Xatruch | L10: Genovès | M10: 90 | O10: 80 | Q10: 90 | R10: =SUM(M10:Q10) -> 260
B11: =SUM(B10)+1 -> 6 | C11: Alba | D11: Torres | E11: Ribas | F11: 4 | G11: 95 | I11: =SUM(I10)+1 -> 6 | J11: Jennifer | K11: Poveda | L11: Pena | M11: 90 | N11: 85 | O11: 70 | R11: =SUM(M11:Q11) -> 245
B12: =SUM(B11)+1 -> 7 | C12: Marta | D12: Velasco | E12: Fillat | F12: 4 | G12: 95 | I12: =SUM(I11)+1 -> 7 | J12: Marc | K12: Cartanyà | L12: Ferré | O12: 50 | P12: 95 | Q12: 95 | R12: =SUM(M12:Q12) -> 240
B13: =SUM(B12)+1 -> 8 | C13: Albert | D13: Martí | E13: Farriol | F13: 4 | G13: 95 | I13: =SUM(I12)+1 -> 8 | J13: Albert | K13: Martí | L13: Farriol | M13: 95 | N13: 65 | P13: 75 | R13: =SUM(M13:Q13) -> 235
B14: =SUM(B13)+1 -> 9 | C14: Sergio | D14: Cortijo | E14: Jiménez | F14: 2 | G14: 95 | I14: =SUM(I13)+1 -> 9 | J14: Robert | K14: Bergé | L14: Sarroca | M14: 100 | N14: 70 | O14: 55 | R14: =SUM(M14:Q14) -> 225
B15: =SUM(B14)+1 -> 10 | C15: Rubén | D15: Martínez | E15: Vallejo | F15: 3 | G15: 90 | I15: =SUM(I14)+1 -> 10 | J15: Marta | K15: Velasco | L15: Fillat | M15: 95 | P15: 75 | Q15: 50 | R15: =SUM(M15:Q15) -> 220
B16: =SUM(B15)+1 -> 11 | C16: Gerard | D16: Feliu | E16: Cendra | F16: 3 | G16: 90 | I16: =SUM(I15)+1 -> 11 | J16: Miguel Angel | K16: Buetas | L16: Triviño | N16: 60 | P16: 85 | Q16: 70 | R16: =SUM(M16:Q16) -> 215
B17: =SUM(B16)+1 -> 12 | C17: Jaume | D17: Fabregat | E17: González | F17: 3 | G17: 90 | I17: =SUM(I16)+1 -> 12 | J17: Manuel David | K17: Recasens | L17: Alvaro | N17: 55 | P17: 85 | Q17: 65 | R17: =SUM(M17:Q17) -> 205
B18: =SUM(B17)+1 -> 13 | C18: Jennifer | D18: Poveda | E18: Pena | F18: 3 | G18: 90 | I18: =SUM(I17)+1 -> 13 | J18: Eduard | K18: Ribalta | L18: Lobo | M18: 85 | N18: 80 | Q18: 40 | R18: =SUM(M18:Q18) -> 205
B19: =SUM(B18)+1 -> 14 | C19: Narcís | D19: Xatruch | E19: Genovès | F19: 3 | G19: 90 | I19: =SUM(I18)+1 -> 14 | J19: Esther | K19: Alegret | L19: Valldosera | M19: 85 | N19: 95 | O19: 0 | R19: =SUM(M19:Q19) -> 180
B20: =SUM(B19)+1 -> 15 | C20: Esther | D20: Alegret | E20: Valldosera | F20: 2 | G20: 85 | I20: =SUM(I19)+1 -> 15 | J20: Rubén | K20: Martínez | L20: Vallejo | M20: 90 | N20: 75 | O20: 0 | R20: =SUM(M20:Q20) -> 165
B21: =SUM(B20)+1 -> 16 | C21: Eduard | D21: Ribalta | E21: Lobo | F21: 2 | G21: 85 | I21: =SUM(I20)+1 -> 16 | J21: Carles | K21: Sienes | L21: Pepio | M21: 100 | N21: 0 | Q21: 55 | R21: =SUM(M21:Q21) -> 155
B22: =SUM(B21)+1 -> 17 | C22: Beatriz | D22: Solano | E22: Bilbao | F22: 2 | G22: 85 | I22: =SUM(I21)+1 -> 17 | J22: Mercè | K22: Cochs | L22: Gaya | M22: 85 | O22: 65 | Q22: 0 | R22: =SUM(M22:Q22) -> 150
B23: =SUM(B22)+1 -> 18 | C23: Mercè | D23: Cochs | E23: Gaya | F23: 2 | G23: 85 | I23: =SUM(I22)+1 -> 18 | J23: Eduard | K23: Ingles | L23: Monteiro | M23: 100 | N23: 0 | Q23: 50 | R23: =SUM(M23:Q23) -> 150
B24: =SUM(B23)+1 -> 19 | C24: Meritxell | D24: Vilella | E24: Maya | F24: 2 | G24: 85 | I24: =SUM(I23)+1 -> 19 | J24: Marc | K24: Moreno | L24: Gené | M24: 100 | N24: 0 | Q24: 50 | R24: =SUM(M24:Q24) -> 150
B25: =SUM(B24)+1 -> 20 | C25: Miguel Angel | D25: Buetas | E25: Triviño | F25: - | G25: - | I25: =SUM(I24)+1 -> 20 | J25: Alba | K25: Torres | L25: Ribas | M25: 95 | P25: 0 | Q25: 50 | R25: =SUM(M25:Q25) -> 145
B26: =SUM(B25)+1 -> 21 | C26: Manuel David | D26: Recasens | E26: Alvaro | F26: - | G26: - | I26: =SUM(I25)+1 -> 21 | J26: Meritxell | K26: Vilella | L26: Maya | M26: 85 | O26: 60 | Q26: 0 | R26: =SUM(M26:Q26) -> 145
B27: =SUM(B26)+1 -> 22 | C27: Marc | D27: Cartanyà | E27: Ferré | F27: - | G27: - | I27: =SUM(I26)+1 -> 22 | J27: Beatriz | K27: Solano | L27: Bilbao | M27: 85 | N27: 0 | Q27: 40 | R27: =SUM(M27:Q27) -> 125
B28: =SUM(B27)+1 -> 23 | C28: Adrià | D28: Morte | E28: Masfarné | F28: - | G28: - | I28: =SUM(I27)+1 -> 23 | J28: Adrià | K28: Morte | L28: Masfarné | M28: 0 | N28: 0 | Q28: 0 | R28: =SUM(M28:Q28) -> 0
C31: Cursa Model - EL CATLLAR
C32: 41375
F33: Temps | G33: Puntuació
B34: 1 | C34: Jaume | D34: Fabregat | E34: González | F34: 3.7118055555555557E-2 | G34: 100
B35: =SUM(B34)+1 -> 2 | C35: Andreu | D35: Blanch | E35: Bargalló | F35: 3.7152777777777778E-2 | G35: 95
B36: =SUM(B35)+1 -> 3 | C36: Esther | D36: Alegret | E36: Valldosera | F36: 3.7152777777777778E-2 | G36: 95
B37: =SUM(B36)+1 -> 4 | C37: Gerard | D37: Feliu | E37: Cendra | F37: 3.8715277777777779E-2 | G37: 90
B38: =SUM(B37)+1 -> 5 | C38: Jennifer | D38: Poveda | E38: Pena | F38: 3.8715277777777779E-2 | G38: 85
B39: =SUM(B38)+1 -> 6 | C39: Eduard | D39: Ribalta | E39: Lobo | F39: 4.3321759259259261E-2 | G39: 80
B40: =SUM(B39)+1 -> 7 | C40: Rubén | D40: Martínez | E40: Vallejo | F40: 4.4097222222222225E-2 | G40: 75
B41: =SUM(B40)+1 -> 8 | C41: Robert | D41: Bergé | E41: Sarroca | F41: 4.4444444444444446E-2 | G41: 70
B42: =SUM(B41)+1 -> 9 | C42: Albert | D42: Martí | E42: Farriol | F42: 4.4675925925925924E-2 | G42: 65
B43: =SUM(B42)+1 -> 10 | C43: Miguel Angel | D43: Buetas | E43: Triviño | F43: 4.5983796296296293E-2 | G43: 60
B44: =SUM(B43)+1 -> 11 | C44: Manuel David | D44: Recasens | E44: Alvaro | F44: 4.6041666666666668E-2 | G44: 55
B45: =SUM(B44)+1 -> 12 | C45: Sergio | D45: Cortijo | E45: Jiménez | F45: 4.673611111111111E-2 | G45: 50
B46: =SUM(B45)+1 -> 13 | C46: Narcís | D46: Xatruch | E46: Genovès | F46: 4.673611111111111E-2 | G46: 45
B47: =SUM(B46)+1 -> 14 | C47: Marc | D47: Moreno | E47: Gené | F47: error targeta | G47: -
B48: =SUM(B47)+1 -> 15 | C48: Eduard | D48: Ingles | E48: Monteiro | F48: error targeta | G48: -
B49: =SUM(B48)+1 -> 16 | C49: Alba | D49: Torres | E49: Ribas | F49: error targeta | G49: -
B50: =SUM(B49)+1 -> 17 | C50: Marta | D50: Velasco | E50: Fillat | F50: error targeta | G50: -
B51: =SUM(B50)+1 -> 18 | C51: Beatriz | D51: Solano | E51: Bilbao | F51: error targeta | G51: -
B52: =SUM(B51)+1 -> 19 | C52: Mercè | D52: Cochs | E52: Gaya | F52: error targeta | G52: -
B53: =SUM(B52)+1 -> 20 | C53: Meritxell | D53: Vilella | E53: Maya | F53: error targeta | G53: -
B54: =SUM(B53)+1 -> 21 | C54: Carles | D54: Sienes | E54: Pepio | F54: no surt | G54: -
B55: =SUM(B54)+1 -> 22 | C55: Marc | D55: Cartanyà | E55: Ferré | F55: no surt | G55: -
B56: =SUM(B55)+1 -> 23 | C56: Adrià | D56: Morte | E56: Masfarné | F56: no surt | G56: -
C59: Puzzle - Tarragona PART ALTA
C60: 41380
E61: Suma | F61: Temps | G61: Puntuació
B62: 1 | C62: Albert | D62: Reverté | E62: 84 | F62: 8.1481481481481474E-3 | G62: 100
B63: =SUM(B62)+1 -> 2 | C63: Sergio | D63: Cortijo | E63: 84 | F63: 1.3969907407407408E-2 | G63: 95
B64: =SUM(B63)+1 -> 3 | C64: Moscoso | E64: 84 | F64: 1.3969907407407408E-2 | G64: 90
B65: =SUM(B64)+1 -> 4 | C65: Jaume | D65: Fabregat | E65: 84 | F65: 2.0914351851851851E-2 | G65: 85
B66: =SUM(B65)+1 -> 5 | C66: Narcís | D66: Xatruch | E66: 78 | F66: 1.0474537037037037E-2 | G66: 80
B67: =SUM(B66)+1 -> 6 | C67: Andreu | D67: Blanch | E67: 74 | F67: 9.8958333333333329E-3 | G67: 75
B68: =SUM(B67)+1 -> 7 | C68: Jennifer | D68: Poveda | E68: 74 | F68: 2.6226851851851852E-2 | G68: 70
B69: =SUM(B68)+1 -> 8 | C69: Mercè | D69: Cochs | E69: 74 | F69: 2.6226851851851852E-2 | G69: 65
B70: =SUM(B69)+1 -> 9 | C70: Meritxell | D70: Vilella | E70: 74 | F70: 2.6226851851851852E-2 | G70: 60
B71: =SUM(B70)+1 -> 10 | C71: Robert | D71: Bergé | E71: 73 | F71: 2.4097222222222225E-2 | G71: 55
B72: =SUM(B71)+1 -> 11 | C72: Marc | D72: Cartanyà | E72: 68 | F72: 9.8958333333333329E-3 | G72: 50
B73: =SUM(B72)+1 -> 12 | C73: Adrià | D73: Morte | E73: - | F73: - | G73: 0
B74: =SUM(B73)+1 -> 13 | C74: Alba | D74: Torres | E74: - | F74: - | G74: 0
B75: =SUM(B74)+1 -> 14 | C75: Albert | D75: Martí | E75: - | F75: - | G75: 0
B76: =SUM(B75)+1 -> 15 | C76: Beatriz | D76: Solano | E76: - | F76: - | G76: 0
B77: =SUM(B76)+1 -> 16 | C77: Carles | D77: Sienes | E77: - | F77: - | G77: 0
B78: =SUM(B77)+1 -> 17 | C78: Eduard | D78: Ribalta | E78: - | F78: - | G78: 0
B79: =SUM(B78)+1 -> 18 | C79: Eduard | D79: Ingles | E79: - | F79: - | G79: 0
B80: =SUM(B79)+1 -> 19 | C80: Esther | D80: Alegret | E80: - | F80: - | G80: 0
B81: =SUM(B80)+1 -> 20 | C81: Gerard | D81: Feliu | E81: - | F81: - | G81: 0
B82: =SUM(B81)+1 -> 21 | C82: Manuel David | D82: Recasens | E82: - | F82: - | G82: 0
B83: =SUM(B82)+1 -> 22 | C83: Marc | D83: Moreno | E83: - | F83: - | G83: 0
B84: =SUM(B83)+1 -> 23 | C84: Marta | D84: Velasco | E84: - | F84: - | G84: 0
B85: =SUM(B84)+1 -> 24 | C85: Miguel Angel | D85: Buetas | E85: - | F85: - | G85: 0
B86: =SUM(B85)+1 -> 25 | C86: Rubén | D86: Martínez | E86: - | F86: - | G86: 0
C89: Cursa model - El Vendrell
C90: 41388
C91: NOM | D91: Cognom | E91: Sortida | F91: Arribada | G91: Temps | H91: Puntuació
B92: 1 | C92: Tomeu | D92: Angulo | E92: 2.2222222222222223E-2 | F92: 4.6469907407407411E-2 | G92: =(F92)-(E92) -> 2.4247685185185188E-2 | H92: 100
B93: =SUM(B92)+1 -> 2 | C93: Marc | D93: Cartanyà | E93: 6.9444444444444441E-3 | F93: 4.3055555555555562E-2 | G93: =(F93)-(E93) -> 3.6111111111111122E-2 | H93: 95
B94: =SUM(B93)+1 -> 3 | C94: Gerard | D94: Feliu | E94: 5.5555555555555558E-3 | F94: 4.3275462962962967E-2 | G94: =(F94)-(E94) -> 3.771990740740741E-2 | H94: 90
B95: =SUM(B94)+1 -> 4 | C95: Andreu | D95: Blanch | E95: 5.5555555555555558E-3 | F95: 4.3275462962962967E-2 | G95: =(F95)-(E95) -> 3.771990740740741E-2 | H95: 90
B96: =SUM(B95)+1 -> 5 | C96: Marta | D96: Velasco | E96: 1.1805555555555555E-2 | F96: 5.1388888888888894E-2 | G96: =(F96)-(E96) -> 3.9583333333333338E-2 | H96: 85
B97: =SUM(B96)+1 -> 6 | C97: Albert | D97: Martí | E97: 1.1805555555555555E-2 | F97: 5.1388888888888894E-2 | G97: =(F97)-(E97) -> 3.9583333333333338E-2 | H97: 85
B98: =SUM(B97)+1 -> 7 | C98: Sergio | D98: Cortijo | E98: 4.1666666666666666E-3 | F98: 4.8611111111111112E-2 | G98: =(F98)-(E98) -> 4.4444444444444446E-2 | H98: 80
B99: =SUM(B98)+1 -> 8 | C99: Miguel Angel | D99: Buetas | E99: 0 | F99: 6.1203703703703705E-2 | G99: =(F99)-(E99) -> 6.1203703703703705E-2 | H99: 75
B100: =SUM(B99)+1 -> 9 | C100: Manuel David | D100: Recasens | E100: 0 | F100: 6.1203703703703705E-2 | G100: =(F100)-(E100) -> 6.1203703703703705E-2 | H100: 75
B101: =SUM(B100)+1 -> 10 | C101: Jaume | D101: Fabregat | E101: 1.3888888888888889E-3 | F101: 6.4513888888888885E-2 | G101: =(F101)-(E101) -> 6.3125000000000001E-2 | H101: 70
B102: =SUM(B101)+1 -> 11 | C102: Jennifer | D102: Poveda | E102: 0 | F102: 0 | G102: 0 | H102: 0
B103: =SUM(B102)+1 -> 12 | C103: Rubén | D103: Martínez | E103: 1.3888888888888889E-3 | F103: 5.2013888888888887E-2 | G103: Error tarj. | H103: 0
B104: =SUM(B103)+1 -> 13 | C104: Esther | D104: Alegret | E104: 2.7777777777777779E-3 | F104: 5.8333333333333327E-2 | G104: Error tarj. | H104: 0
B105: =SUM(B104)+1 -> 14 | C105: Maria | D105: Alegret | E105: 2.7777777777777779E-3 | F105: 5.8333333333333327E-2 | G105: Error tarj. | H105: 0
B106: =SUM(B105)+1 -> 15 | C106: Carles | D106: Sienes | E106: 1.3194444444444444E-2 | F106: 6.896990740740741E-2 | G106: Error tarj. | H106: 0
B107: =SUM(B106)+1 -> 16 | C107: Robert | D107: Bergé | E107: - | F107: - | G107: - | H107: 0
B108: =SUM(B107)+1 -> 17 | C108: Narcís | D108: Xatruch | E108: - | F108: - | G108: - | H108: 0
B109: =SUM(B108)+1 -> 18 | C109: Mercè | D109: Cochs | E109: - | F109: - | G109: - | H109: 0
B110: =SUM(B109)+1 -> 19 | C110: Marc | D110: Moreno | E110: - | F110: - | G110: - | H110: 0
B111: =SUM(B110)+1 -> 20 | C111: Eduard | D111: Ribalta | E111: - | F111: - | G111: - | H111: 0
B112: =SUM(B111)+1 -> 21 | C112: Eduard | D112: Ingles | E112: - | F112: - | G112: - | H112: 0
B113: =SUM(B112)+1 -> 22 | C113: Beatriz | D113: Solano | E113: - | F113: - | G113: - | H113: 0
B114: =SUM(B113)+1 -> 23 | C114: Alba | D114: Torres | E114: - | F114: - | G114: - | H114: 0
B115: =SUM(B114)+1 -> 24 | C115: Adrià | D115: Morte | E115: - | F115: - | G115: - | H115: 0
C118: SCORE - Platja Llarga
C119: 41388
C120: NOM | D120: Cognom | E120: Sortida | F120: Arribada | G120: Temps | H120: Puntuació
B121: 1 | C121: Gerard | D121: Feliu | E121: 6.9444444444444441E-3 | F121: 2.6458333333333334E-2 | G121: =(F121)-(E121) -> 1.951388888888889E-2 | H121: 100
B122: =SUM(B121)+1 -> 2 | C122: Marc | D122: Cartanyà | E122: 6.9444444444444441E-3 | F122: 2.6562499999999999E-2 | G122: =(F122)-(E122) -> 1.9618055555555555E-2 | H122: 95
B123: =SUM(B122)+1 -> 3 | C123: Narcís | D123: Xatruch | E123: 0 | F123: 1.9733796296296298E-2 | G123: =(F123)-(E123) -> 1.9733796296296298E-2 | H123: 90
B124: =SUM(B123)+1 -> 4 | C124: Andreu | D124: Blanch | E124: 6.9444444444444441E-3 | F124: 2.7013888888888889E-2 | G124: =(F124)-(E124) -> 2.0069444444444445E-2 | H124: 85
B125: =SUM(B124)+1 -> 5 | C125: Cristina | D125: Agustench | E125: 6.9444444444444441E-3 | F125: 2.7164351851851853E-2 | G125: =(F125)-(E125) -> 2.0219907407407409E-2 | H125: 80
B126: =SUM(B125)+1 -> 6 | C126: David | D126: Labrador | E126: 0 | F126: 2.3657407407407408E-2 | G126: =(F126)-(E126) -> 2.3657407407407408E-2 | H126: 75
B127: =SUM(B126)+1 -> 7 | C127: Miguel Angel | D127: Buetas | E127: 0 | F127: 2.5474537037037035E-2 | G127: =(F127)-(E127) -> 2.5474537037037035E-2 | H127: 70
B128: =SUM(B127)+1 -> 8 | C128: Manuel David | D128: Recasens | E128: 0 | F128: 2.5578703703703704E-2 | G128: =(F128)-(E128) -> 2.5578703703703704E-2 | H128: 65
B129: =SUM(B128)+1 -> 9 | C129: Sergio | D129: Cortijo | E129: 0 | F129: 2.5740740740740745E-2 | G129: =(F129)-(E129) -> 2.5740740740740745E-2 | H129: 60
B130: =SUM(B129)+1 -> 10 | C130: Carles | D130: Sienes | E130: 0 | F130: 2.7152777777777779E-2 | G130: =(F130)-(E130) -> 2.7152777777777779E-2 | H130: 55
B131: =SUM(B130)+1 -> 11 | C131: Marta | D131: Velasco | E131: 6.9444444444444441E-3 | F131: 4.1666666666666664E-2 | G131: =(F131)-(E131) -> 3.4722222222222224E-2 | H131: 50
B132: =SUM(B131)+1 -> 12 | C132: Albert | D132: Martí | E132: 6.9444444444444441E-3 | F132: 4.1666666666666664E-2 | G132: =(F132)-(E132) -> 3.4722222222222224E-2 | H132: 50
B133: =SUM(B132)+1 -> 13 | C133: Marc | D133: Moreno | E133: 6.9444444444444441E-3 | F133: 4.1666666666666664E-2 | G133: =(F133)-(E133) -> 3.4722222222222224E-2 | H133: 50
B134: =SUM(B133)+1 -> 14 | C134: Eduard | D134: Ingles | E134: 6.9444444444444441E-3 | F134: 4.1666666666666664E-2 | G134: =(F134)-(E134) -> 3.4722222222222224E-2 | H134: 50
B135: =SUM(B134)+1 -> 15 | C135: Alba | D135: Torres | E135: 6.9444444444444441E-3 | F135: 4.1666666666666664E-2 | G135: =(F135)-(E135) -> 3.4722222222222224E-2 | H135: 50
B136: =SUM(B135)+1 -> 16 | C136: Jennifer | D136: Poveda | E136: 0 | F136: 4.1666666666666664E-2 | G136: =(F136)-(E136) -> 4.1666666666666664E-2 | H136: 45
B137: =SUM(B136)+1 -> 17 | C137: Eduard | D137: Ribalta | E137: 6.9444444444444441E-3 | F137: 7.8472222222222221E-2 | G137: =(F137)-(E137) -> 7.1527777777777773E-2 | H137: 40
B138: =SUM(B137)+1 -> 18 | C138: Beatriz | D138: Solano | E138: 6.9444444444444441E-3 | F138: 7.8472222222222221E-2 | G138: =(F138)-(E138) -> 7.1527777777777773E-2 | H138: 40
B139: =SUM(B138)+1 -> 19 | C139: Esther | D139: Alegret | E139: 6.9444444444444441E-3 | F139: 4.1666666666666664E-2 | G139: Error tarj. | H139: 0
B140: =SUM(B139)+1 -> 20 | C140: Jaume | D140: Fabregat | E140: 0 | F140: 0 | G140: No surt | H140: 0
B141: =SUM(B140)+1 -> 21 | C141: Mercè | D141: Cochs | E141: 0 | F141: 0 | G141: No surt | H141: 0
B142: =SUM(B141)+1 -> 22 | C142: Albert | D142: Reverté | E142: 0 | F142: 1.5972222222222224E-2 | G142: Error tarj. | H142: 0
B143: =SUM(B142)+1 -> 23 | C143: Rubén | D143: Martínez | E143: 0 | F143: 2.8611111111111115E-2 | G143: Error tarj. | H143: 0
B144: =SUM(B143)+1 -> 24 | C144: Robert | D144: Bergé | E144: 0 | F144: 2.6550925925925926E-2 | G144: Error tarj. | H144: 0
B145: =SUM(B144)+1 -> 25 | C145: Adrià | D145: Morte | E145: 0 | F145: 0 | G145: No surt | H145: 0