E2: Abril
B3: ASSISTÈNCIES | E3: TEÒRICA | F3: TEÒRICA | G3: PONT DIABLE | H3: CATLLAR | I3: ALTAFULLA | J3: TARRAGONA | K3: - | L3: - | M3: -
E4: 2 | F4: 4 | G4: 9 | H4: 11 | I4: 14 | J4: 16 | K4: 18 | L4: 23 | M4: 25 | N4: Suma | O4: Limit
B5: Esther | C5: Alegret | D5: Valldosera | E5: 0.10416666666666667 | F5: 0.10416666666666667 | G5: 8.3333333333333329E-2 | H5: 8.3333333333333329E-2 | I5: 0.22916666666666666 | J5: 8.3333333333333329E-2 | K5: 8.3333333333333329E-2 | L5: 8.3333333333333329E-2 | M5: 8.3333333333333329E-2 | N5: =SUM(E5:M5) -> 0.9375 | O5: 0.72916666666666663
B6: Robert | C6: Bergé | D6: Sarroca | E6: 0.10416666666666667 | F6: 0.10416666666666667 | G6: 8.3333333333333329E-2 | H6: 8.3333333333333329E-2 | I6: 0.22916666666666666 | J6: 8.3333333333333329E-2 | K6: 8.3333333333333329E-2 | L6: FALTA | M6: 8.3333333333333329E-2 | N6: =SUM(E6:M6) -> 0.85416666666666674 | O6: 0.72916666666666663
B7: Andreu | C7: Blanch | D7: Bargalló | E7: 0.10416666666666667 | F7: 0.10416666666666667 | G7: 8.3333333333333329E-2 | H7: 8.3333333333333329E-2 | I7: 0.22916666666666666 | J7: 8.3333333333333329E-2 | K7: 8.3333333333333329E-2 | L7: 8.3333333333333329E-2 | M7: 8.3333333333333329E-2 | N7: =SUM(E7:M7) -> 0.9375 | O7: 0.72916666666666663
B8: Miguel Angel | C8: Buetas | D8: Triviño | E8: 0.10416666666666667 | F8: 0.10416666666666667 | G8: FALTA | H8: 8.3333333333333329E-2 | I8: 0.22916666666666666 | J8: FALTA | K8: 8.3333333333333329E-2 | L8: 8.3333333333333329E-2 | M8: 8.3333333333333329E-2 | N8: =SUM(E8:M8) -> 0.77083333333333348 | O8: 0.72916666666666663
B9: Marc | C9: Cartanyà | D9: Ferré | E9: 0.10416666666666667 | F9: 0.10416666666666667 | G9: FALTA | H9: FALTA | I9: 0.22916666666666666 | J9: 8.3333333333333329E-2 | K9: 8.3333333333333329E-2 | L9: 8.3333333333333329E-2 | M9: 8.3333333333333329E-2 | N9: =SUM(E9:M9) -> 0.77083333333333348 | O9: 0.72916666666666663
B10: Mercè | C10: Cochs | D10: Gaya | E10: 0.10416666666666667 | F10: 0.10416666666666667 | G10: 8.3333333333333329E-2 | H10: 8.3333333333333329E-2 | I10: 0.22916666666666666 | J10: 8.3333333333333329E-2 | K10: 8.3333333333333329E-2 | L10: FALTA | M10: FALTA | N10: =SUM(E10:M10) -> 0.77083333333333337 | O10: 0.72916666666666663
B11: Jaume | C11: Fabregat | D11: González | E11: 0.10416666666666667 | F11: 0.10416666666666667 | G11: 8.3333333333333329E-2 | H11: 8.3333333333333329E-2 | I11: 0.22916666666666666 | J11: 8.3333333333333329E-2 | K11: 8.3333333333333329E-2 | L11: FALTA | M11: FALTA | N11: =SUM(E11:M11) -> 0.77083333333333337 | O11: 0.72916666666666663
B12: Gerard | C12: Feliu | D12: Cendra | E12: 0.10416666666666667 | F12: 0.10416666666666667 | G12: 8.3333333333333329E-2 | H12: 8.3333333333333329E-2 | I12: 0.22916666666666666 | J12: 8.3333333333333329E-2 | K12: 8.3333333333333329E-2 | L12: 8.3333333333333329E-2 | M12: 8.3333333333333329E-2 | N12: =SUM(E12:M12) -> 0.9375 | O12: 0.72916666666666663
B13: Eduard | C13: Ingles | D13: Monteiro | E13: 0.10416666666666667 | F13: 0.10416666666666667 | G13: 8.3333333333333329E-2 | H13: 8.3333333333333329E-2 | I13: 0.22916666666666666 | J13: 8.3333333333333329E-2 | K13: 8.3333333333333329E-2 | L13: 8.3333333333333329E-2 | M13: 8.3333333333333329E-2 | N13: =SUM(E13:M13) -> 0.9375 | O13: 0.72916666666666663
B14: Albert | C14: Martí | D14: Farriol | E14: 0.10416666666666667 | F14: 0.10416666666666667 | G14: 8.3333333333333329E-2 | H14: 8.3333333333333329E-2 | I14: 0.22916666666666666 | J14: FALTA | K14: 8.3333333333333329E-2 | L14: 8.3333333333333329E-2 | M14: 8.3333333333333329E-2 | N14: =SUM(E14:M14) -> 0.85416666666666674 | O14: 0.72916666666666663
B15: Rubén | C15: Martínez | D15: Vallejo | E15: 0.10416666666666667 | F15: 0.10416666666666667 | G15: 8.3333333333333329E-2 | H15: 8.3333333333333329E-2 | I15: 0.22916666666666666 | J15: FALTA | K15: 8.3333333333333329E-2 | L15: 8.3333333333333329E-2 | M15: 8.3333333333333329E-2 | N15: =SUM(E15:M15) -> 0.85416666666666674 | O15: 0.72916666666666663
B16: Marc | C16: Moreno | D16: Gené | E16: 0.10416666666666667 | F16: 0.10416666666666667 | G16: 8.3333333333333329E-2 | H16: 8.3333333333333329E-2 | I16: 0.22916666666666666 | J16: FALTA | K16: 8.3333333333333329E-2 | L16: 8.3333333333333329E-2 | M16: 8.3333333333333329E-2 | N16: =SUM(E16:M16) -> 0.85416666666666674 | O16: 0.72916666666666663
B17: Adrià | C17: Morte | D17: Masfarné | E17: 0.10416666666666667 | F17: FALTA | G17: FALTA | H17: FALTA | I17: FALTA | J17: FALTA | K17: FALTA | L17: FALTA | M17: FALTA | N17: =SUM(E17:M17) -> 0.10416666666666667 | O17: 0.72916666666666663
B18: Jennifer | C18: Poveda | D18: Pena | E18: 0.10416666666666667 | F18: 0.10416666666666667 | G18: 8.3333333333333329E-2 | H18: 8.3333333333333329E-2 | I18: 0.22916666666666666 | J18: 8.3333333333333329E-2 | K18: 8.3333333333333329E-2 | L18: 8.3333333333333329E-2 | M18: 8.3333333333333329E-2 | N18: =SUM(E18:M18) -> 0.9375 | O18: 0.72916666666666663
B19: Manuel David | C19: Recasens | D19: Alvaro | E19: 0.10416666666666667 | F19: 0.10416666666666667 | G19: FALTA | H19: 8.3333333333333329E-2 | I19: 0.22916666666666666 | J19: FALTA | K19: 8.3333333333333329E-2 | L19: 8.3333333333333329E-2 | M19: 8.3333333333333329E-2 | N19: =SUM(E19:M19) -> 0.77083333333333348 | O19: 0.72916666666666663
B20: Eduard | C20: Ribalta | D20: Lobo | E20: 0.10416666666666667 | F20: 0.10416666666666667 | G20: 8.3333333333333329E-2 | H20: 8.3333333333333329E-2 | I20: 0.22916666666666666 | J20: 8.3333333333333329E-2 | K20: 8.3333333333333329E-2 | L20: 8.3333333333333329E-2 | M20: 8.3333333333333329E-2 | N20: =SUM(E20:M20) -> 0.9375 | O20: 0.72916666666666663
B21: Carles | C21: Sienes | D21: Pepio | E21: 0.10416666666666667 | F21: 0.10416666666666667 | G21: 8.3333333333333329E-2 | H21: FALTA | I21: 0.22916666666666666 | J21: 8.3333333333333329E-2 | K21: FALTA | L21: 8.3333333333333329E-2 | M21: 8.3333333333333329E-2 | N21: =SUM(E21:M21) -> 0.77083333333333348 | O21: 0.72916666666666663
B22: Beatriz | C22: Solano | D22: Bilbao | E22: 0.10416666666666667 | F22: 0.10416666666666667 | G22: 8.3333333333333329E-2 | H22: 8.3333333333333329E-2 | I22: 0.22916666666666666 | J22: 8.3333333333333329E-2 | K22: 8.3333333333333329E-2 | L22: FALTA | M22: 8.3333333333333329E-2 | N22: =SUM(E22:M22) -> 0.85416666666666674 | O22: 0.72916666666666663
B23: Alba | C23: Torres | D23: Ribas | E23: 0.10416666666666667 | F23: 0.10416666666666667 | G23: 8.3333333333333329E-2 | H23: 8.3333333333333329E-2 | I23: 0.22916666666666666 | J23: FALTA | K23: 8.3333333333333329E-2 | L23: 8.3333333333333329E-2 | M23: 8.3333333333333329E-2 | N23: =SUM(E23:M23) -> 0.85416666666666674 | O23: 0.72916666666666663
B24: Marta | C24: Velasco | D24: Fillat | E24: 0.10416666666666667 | F24: 0.10416666666666667 | G24: 8.3333333333333329E-2 | H24: 8.3333333333333329E-2 | I24: 0.22916666666666666 | J24: FALTA | K24: 8.3333333333333329E-2 | L24: 8.3333333333333329E-2 | M24: 8.3333333333333329E-2 | N24: =SUM(E24:M24) -> 0.85416666666666674 | O24: 0.72916666666666663
B25: Narcís | C25: Xatruch | D25: Genovès | E25: 0.10416666666666667 | F25: 0.10416666666666667 | G25: 8.3333333333333329E-2 | H25: 8.3333333333333329E-2 | I25: 0.22916666666666666 | J25: 8.3333333333333329E-2 | K25: 8.3333333333333329E-2 | L25: FALTA | M25: 8.3333333333333329E-2 | N25: =SUM(E25:M25) -> 0.85416666666666674 | O25: 0.72916666666666663
B26: Sergio | C26: Cortijo | D26: Jiménez | E26: 0.10416666666666667 | F26: 0.10416666666666667 | G26: 8.3333333333333329E-2 | H26: 8.3333333333333329E-2 | I26: 0.22916666666666666 | J26: 8.3333333333333329E-2 | K26: 8.3333333333333329E-2 | L26: 8.3333333333333329E-2 | M26: 8.3333333333333329E-2 | N26: =SUM(E26:M26) -> 0.9375 | O26: -
B27: Meritxell | C27: Vilella | D27: Maya | E27: 0.10416666666666667 | F27: 0.10416666666666667 | G27: 8.3333333333333329E-2 | H27: 8.3333333333333329E-2 | I27: 0.22916666666666666 | J27: 8.3333333333333329E-2 | K27: 8.3333333333333329E-2 | L27: - | M27: - | N27: =SUM(E27:M27) -> 0.77083333333333337 | O27: -